English Title	Original Title	Director/Creator	Year	Format	Languages	Countries	Platforms	Summary	Tags	IMDb Tag Number
It's All Gone Pete Tong		Michael Dowse	2004	Feature	English; Spanish	Canada; UK		Erratic electro DJ progressively loses his hearing when refusing to protect his ears from his music	adapting to deafness; deaf musician/dancer; deaf-hearing relationship; deafened by sound exposure; music; progessive hearing loss; vibrations	
It's My Party		Randal Kleiser	1996	Feature	English	US		Drama about AIDS patients and their dignity includes deaf supporting character	drama; queer	
Italian Postcards	Cartoline italiene	Meme Perlini	1987	Feature	Italian; Italian Sign Language (LIS)	Italy		Owner of a boarding house poses as famous actress to interview a star; includes passages in sign language	drama	
The Italian Straw Hat	Un chapeau de paille d’Italie	René Clair	1927	Feature		France		Silent comedy of errors about a lost straw hat on a wedding day, featuring a deaf uncle character with an ear trumpet who is a source of comedy but also resolves the conflict by gifting the character a new straw hat	ageing deaf character as comic relief; comedy	
Jack Paradise		Gilles Noël	2004	Feature	French	Canada		Canadian jazz pianist works in Montreal and has a deaf son	deaf child hearing parent; music	
	Jagdhunde	Ann-Kristin Reyels	2007	Feature	German	Germany		Teen boy and his father are unwelcome in their village, boy meets deaf girl at one point	deaf-hearing relationship; drama; family drama	
	Jean de Florette	Claude Berri	1986	Feature	French	France; Italy; Switzerland		Period drama includes a deaf maid character played by deaf actor Chantal Liennel (see also sequel, Manon des sources)	deaf actor; deaf servant; drama	
The Jennie Project		Gary Nadeau	2001	Feature	American Sign Language (ASL); English	US	Disney+	Documentary about Jennie, a chimpanzee who was taught American Sign Language (ASL)	signing animal	
Jerry Maguire		Cameron Crowe	1996	Feature	American Sign Language (ASL); English	US		Deaf content only in cameo, but this romantic comedy includes a moment of American Sign Language (ASL) signing in elevator	romantic comedy	
Jesus of Macon, Georgia		Todd J. Phelps	2008	Short	English	US		Story of father and son in Georgia US, includes deaf boy side character	deaf child; family drama	
Jesus' Son		Alison McLean	1999	Feature	English	Canada; US		Billy Crudup drama includes football player possibly pretending to be deaf	drama; hearing person pretending to be deaf; sports	
Jobman		Darrell Roodt	1989	Feature 	Afrikaans; English	South Africa		Drama about a preacher who is nonverbal due to loss of his tongue	drama; nonverbal; nonverbal due to tongue being cut out; religion	
Johnny Belinda		Jean Negulesco	1948	Feature	American Sign Language (ASL); English	US		Young deaf woman is tutored in sign by a hearing doctor, but then is raped by another man and falls pregnant	deaf character inspires hearing character’s self-actualisation; deaf victim/witness; hearing actor in deaf role; hearing teacher; isolation; learning sign	
Johnny Belinda		Paul Bogart; Gary Nelson	1967	Feature	English	US		Remake of 1948 film about young deaf woman who is tutored by hearing doctor, then is raped by another man and falls pregnant	deaf character inspires hearing character’s self-actualisation; deaf victim/witness; hearing actor in deaf role; hearing teacher; isolation; learning sign	
Johnny Dangerously		Amy Heckerling	1984	Feature 	English	US		Slapstick comedy with many disability jokes, including a gag where a blind newspaper seller regains his sight after being hit in the head with a bunch of newspapers, then is immediately deafened by another	comedy; deaf and blind character pairing; deafness 'cured'	
Junk Mail	Budbringeren	Pal Sletaune	1996	Feature	Norwegian	Norway		A depressed, lonely man finds the keys to a neighbour's apartment in his letterbox, enters the apartment and finds a hard-of-hearing woman having attempted suicide; they begin a relationship in which she lipreads as their communication	drama; deaf-hearing relationship; lipreading, inc. magical	
The Key		Francis James	1996	Short	American Sign Language (ASL)	US		American Sign Language (ASL) short in which man and woman travelling across the US encounter a drifter	all/most dialogue in sign language	
Khamoshi: The Musical		Sanjay Leela Bhansali	1996	Feature	Hindi	India		Musical love story between deaf couple	deaf musician/dancer; music; romance	
The King of Marvin Gardens		Bob Rafelson	1972	Feature	American Sign Language (ASL); English	US		Bruce Dern and Jack Nicholson play brothers who team up for a get-rich-quick scheme, includes passages in sign language	crime/mystery; sibling relationship	
King's Quest V: Absence Makes the Heart Go Yonder		Roberta Williams	1990	Video game	English 	US		Video game fantasy quest includes 'deaf sailor' character as key play point (more details needed)	sci-fi/fantasy	
Kinneret's Secrets	Ha-Sodot Shel Kineret	Micha Shagrir	1998-2000	Series	Hebrew	Israel		A deaf girl attempts to solve her father's death	deaf victim/witness; family drama; grief; revenge/vigilante	
Knowing		Alex Proyas	2009	Feature	English	UK; US	Prime	Science fiction film in which character wears hearing aid and hears voices	deaf mystic; hearing aid; sci-fi/fantasy	
	Koji Inoue, photographe au-delà des signes	Brigitte Lemaine	1999	Documentary	French; French Sign Language (LSF); Japanese; Japanese Sign Language (JSL)	France		Documentary about Japanese deaf photographer, Koji Inoue	deaf artist	
Koko: A Talking Gorilla	Koko, le gorille qui parle	Barbet Schroeder	1978	Documentary	English; French; French Sign Language (LSF)	France		Documentary about Koko the signing gorilla	signing animal	
	Kommunikasjon med tegn: Et opplegg for flere målgrupper	Døves Forlag	1992	Documentary	Norwegian; Norwegian Sign Language (NSL)	Norway		Norwegian documentary about deafness	accessibility; Deaf Culture	
Kung Fu Hustle		Stephen Chow	2004	Feature	Cantonese; Chinese Sign Language (CSL); Mandarin	China; Hong Kong; US		Gangster thriller includes secondary scene with deaf girl signing	crime/mystery	
L.A. Confidential		Jeffrey D. Brown	1992	Series	English	US		Season 7 episode 5 ("My Friend Flicker") of this legal crime drama includes a deaf woman being sued by a deaf organisation (series duration 1986-94)	Deaf Culture; deaf villain/suspect; drama; hearing lawyer of deaf defendant	
	L’Abbé de l’Epée	Michel Rouvière	1982	Feature	French Sign Language (LSF); French	France		Unreleased biopic of the Abbé de l’Epée, 18th-century founder of the first School for the Deaf, produced by the Fédération Nationale des Sourds de France (FNSF, National Federation of Deafness in France) with an all-Deaf cast and director	Deaf Culture; deaf actor; deaf child; deaf director; learning sign; School for the Deaf	
	L'Absence	Mama Keïta	2009	Feature	French; Wolof	France; Guinea; Senegal		A young man returns home to Senegal after many years living in Paris to find his deaf sister traumatised	drama; family drama; grief; sibling relationship	
	L'Educateur	Dominique Tabuteau	1995	Series	French	France		The unpurchased pilot episode ("Trop libre pour toi"/"Too Free for You") of this Marseille-set banlieue series revolves around a hearing teacher with a deaf brother	drama; sibling relationship	
	L'Enfance sourde	Brigitte Lemaine	2008	Documentary	French Sign Language (LSF); French	France		Coda-directed documentary about the childhood of a young French Coda girl	Coda; Deaf Culture; learning sign	
The L Word		Michele Abbott; Ilene Chaiken; Kathy Greenberg	2004-9	Series	American Sign Language (ASL); English	Canada; US	Showtime	Lesbian drama with recurring deaf character (Marlee Matlin)	deaf actor; drama; romance; queer	
	La belle de Fontenay	Paule Zajdermann	1994	Feature	French	France		TV movie thriller in which lipreading older man deafened as a child is falsely accused of the murder of a local woman; conducts his own investigation	crime/mystery; deaf victim/witness; deaf villain/suspect; lipreading, inc. magical	
	La Brute	Claude Guillemot	1986	Feature	French; French Sign Language (LSF)	France		One of two adaptations of Guy des Cars' novel La Brute (see also The Green Scarf), about a deafblind author accused of the murder of a man harrassing his wife.	deaf victim/witness; deaf villain/suspect; deafblind character	
	La Femme de la forêt	Arnaud Sélignac	1996	Series	French	France		TV mini-series about a woman who works as a forester and discovers corruption in her town; her son is friends with the corrupt mayor's deaf son; the two communicate through mime and other tools	crime/mystery; deaf child; deaf child hearing parent; family drama; friendship	
	La femme enfant	Raphaële Billetdoux	1980	Feature	French; French Sign Language (LSF)	France		Drama in which a nonverbal gardener develops a friendship with a teenaged girl who appears to be the only person he communicates with, killing himself when she leaves the village	drama; friendship; isolation; nonverbal; wild child	
	La Ferme aux loups	Richard Pottier	1943	Feature	French	France		Crime mystery in which hearing reporters investigate a double murder; the culprit is found to be a 'feral' deaf man seeking vengeance for his late parents who lost their farm years before	crime/mystery; deaf villain/suspect; isolation; revenge/vigilante; thriller; wild child	
	La minute nécessaire de Monsieur Cyclopède	Jean-Louis Fournier	1982	Documentary	French; French Sign Language (LSF)	France		Season 1 episodes 21 ("Compatissons aux misères humaines à peu de frais: 2") and 29 ("Asseyons un aveugle dans un fauteuil pour sourd") of this comedy short program are about deafness and sign language interpreting (series duration 1982-4). 	comedy	
	La Noche violenta	José María Fernández Unsáin	1970	Feature	Spanish	Mexico		Murderer drama includes a killer in house with deaf woman and her father	crime/mystery; deaf victim/witness; drama; hearing stalker/killer; survival narrative	
	La Nuit miraculeuse	Ariane Mnouchkine	1989	Feature	French	France		Moralistic TV movie released during the 200-year anniversary of the Revolution, about Enlightenment figures who come back to life to debate the rights of different minority groups, one of which is the Deaf Community represented by a group of French Deaf actors including Emmanuelle Laborit	accessibility; deaf actor; Deaf Culture	
	La Poison	Sacha Guitry	1951	Feature	French	France		Crime comedy about a man who doesn't try to hide that he's murdered his wife includes a deaf pharmacist side character	comedy; crime/mystery	
	La Sourde oreille	Michel Polac	1980	Feature	French	France		French feature listing deafness as theme (more details needed)	drama	
	La Surditude	Yves Dion	1981	Documentary	French	Canada		Canadian documentary short about the importance of Deaf access; the title is a blend of the French words for deafness and solitude	accessibility; Deaf Culture	
Lady for a Day		Frank Capra	1933	Feature	English	US		Comedy including a young deaf woman flower seller, remade in 1961 by the same director as the more successful Pocketful of Miracles	comedy	
Lady Zee	Leydi Zi	Georgi Djulgerov	2005	Feature	Bulgarian; Bulgarian Sign Language	Bulgaria		Abused young orphan woman's coming-of-age includes passages in sign language	drama	
Land of the Giants		Harry Harris	1969	Series	English	US		Season 1 episode 25 ("Shell Game") of this series is about a nearly-bankrupt man who tries to help his deaf son (series duration 1968-70)	deaf child hearing parent	
Land of Silence and Darkness	Land des Shweigens und der Dunkelheit	Werner Herzog	1971	Documentary	German; German Sign Language (DGS)	Germany		Werner Herzog documentary about a group of deafblind people and their sensory experience	accessibility; Deaf Culture; deafblind documentary; disability	
Language Says It All		Rhyena Halpern	1987	Documentary	English	US		Documentary short about deaf children and their carers (received an Oscar nomination)	accessibility; deaf child; hearing teacher; learning sign	
The Last Game		Tom Parrish	1995	Feature	American Sign Language (ASL); English	US		Young Hard of Hearing woman joins a basketball team	sports	
Last Mountain		Robert Fleet	2005	Feature	English	US		A deaf veteran (Deanne Bray) goes on a quest to find a unicorn in the mountains	deaf actor	
The Last Mouse of Hamelin		Connie Rasinski	1955	Children's short	English	US		Children's animation short about a deaf mouse who was not susceptible to the Pied Piper of Hamelin's pipe	character survives dangerous sound thanks to deafness; Deaf Gain; music	
Law and Order		Dick Wolff	1993	Series	American Sign Language (ASL); English	US		Season 3 episode 22 ("Benevolence") of this long-running NYC criminal investigation series is about the murder of a Deaf woman;  the suspects are her former partner and her mentor at a Deaf community organisation. Includes signing Deaf actors John Maucere, John F. Cleary and Camille L. Jeter	crime/mystery; deaf actor; deaf victim/witness; deaf villain/suspect; deaf-hearing relationship; Deaf Culture; hearing stalker/killer	
Law and Order: Criminal Intent		Dean White	2007	Series	American Sign Language (ASL); English	US		Season 6 episode 18 ("Silencer") of this legal crime series is about the murder of a prominent cochlear implant surgeon and leads to suspects in the deaf community (series duration 2001-11). Includes deaf actor Martina Bell	crime/mystery; cochlear implant; Deaf Culture; deaf villain/suspect	
	Le Bateau de mariage	Jean-Pierre Améris 	1992	Feature	French	France; Switzerland		Provincial drama about a newly married couple in Vichy France includes a secondary relationship between a young hearing boy and deaf girl played by verbal Deaf actor Noémie Churlet, whose father locks her away from her lover	deaf actor; deaf child hearing parent; deaf-hearing relationship; romance	
	Le Coup suprême	Jean-Pierre Sentier	1991	Feature	French; French Sign Language (LSF)	France		An orphaned Sami boy must recover his community's ancestral totem; during his journey he meets a nonverbal hearing little person who communicates in sign	adoption/foster care; grief; Indigenous character/themes; nonverbal character	
	Le Cowboy	Georges Lautner	1985	Feature	Chinese Sign Language (CSL); French; French Sign Language (LSF)	France		Crime comedy in which one comedy sequence features a deaf Chinese man living in the 13th arrondissement of Paris who cannot understand the interpreter hired to translate for him as he knows Chinese Sign Language (CSL) not French Sign Language (LSF).	comedy; crime/mystery; deaf villain/suspect; deaf victim/witness	
Le Cri	Le Cri	Emmanuel Robert-Espalieu	2002	Short	French; French Sign Language (LSF)	France		Soldiers using sign in trenches in 1917	Deaf Gain	
	Le Crime des justes	Jean Gehret	1948	Feature	French	France		Tragic drama about a deaf girl who is adopted by a wealthy family in her rural village; she becomes pregnant by her stepbrother and loses the baby after a traumatic birth during which the family won't call a doctor	deaf victim/witness; family drama; hearing actor in deaf role; sibling relationship	
	Le Droit à l'oubli	Gérard Vergez	1993	Feature	French	France		Psychological thriller TV movie in which the protagonist becomes obsessed with another woman; her deaf maid is one of her final anchors to reality	crime/mystery; deaf servant; deaf victim/witness	
The Legend of the Mountain Man		Mark Wood	2008	Feature	American Sign Language (ASL)	US		Family friendly fantasy adventure in AS	all/most dialogue in sign language	
	Le Miraculé	Jean-Pierre Mocky	1987	Feature	French	France		Comedy set in the Christian pilgrims' city of miracles, Lourdes, in which a hearing nonverbal man (unable to speak since he's been shot in the throat) tries to uncover a fraudulent man pretending to be cured of paralysis	comedy; nonverbal	
	Le Propre de l'homme	Marc Rivière	1996	Feature	French; French Sign Language (LSF)	France		TV movie in which Deaf wife (Emmanuelle Laborit) and hearing husband teach a chimpanzee to sign	deaf actor; signing animal	
	Le Refuge	Alain Schwartzstein	1997	Series	French	France		Season 1 episode 4 ("Les Moutons d'Anatole"/"Anatole's Sheep") of this rural veterinarian series is about corrupt livestock traffickers in a village with several deaf children; a deaf child with amnesia is the only witness to the crime	deaf child; deaf victim/witness	
	Le Théâtre de la mer	Simone Vannier	1982	Children's feature	French	France		Children's TV movie about a mermaid kept at a human court, played by Emmanuelle Laborit	deaf actor	
The Leaving of Liverpool		Michael Jenkins	1993	Feature	English	Australia; UK		TV movie about the British orphans who were adopted out to colonies after WWII, including a young hard of hearing boy rendered profoundly deaf after he's hit on the head	adoption/foster care; deaf child; deafened by accident/violence; isolation	
	Les Enfants des néons 	Brahim Tsaki	1991	Feature	French	France		Banlieue film about two Franco-Arab young men, one deaf, trying to survive by selling abandoned items from construction sites	friendship	
	Les Innocents	André Téchiné	1987	Feature	French	France		Romantic drama in which a hearing woman visits a Southern town for her sister's wedding and is embroiled in tense conflict. The sisters also have a deaf younger brother, played by hard of hearing actor, Stéphane Onfroy.	deaf actor; deaf victim/witness; drama; family drama; sibling relationship	
	Les Mains du silence	Simone Vannier	1977	Documentary	French; French Sign Language (LSF)	France		Two-part documentary composed largely of sign language interviews with Deaf Community, about the importance of sign language access and Deaf education	accessibility; deaf child; Deaf Culture; learning sign; school/university setting	
	Les Mains du sourd	Brigitte Lemaine; Jean-Louis Laher	1988	Documentary	French; French Sign Language (LSF)	France		Interviews with deaf people about sign language access at the Paris museum, le Palais de Tokyo	accessibility; deaf artist; Deaf Culture; learning sign	
	Les Mots bleus	Alain Corneau	2005	Feature	Catalan; French; French Sign Language (LSF)	France		Mother of a nonverbal hearing child sends her daughter to a School for the Deaf	deaf child; family drama; learning sign; nonverbal; School for the Deaf	
	Les Mots perdus	Marcel Simard	1993	Documentary	French	Canada		Quebec-based documentary about experiences of aphasia features nonverbal people from Canada, France, Switzerland and Belgium	nonverbal	
	Les Oreilles entre les dents	Patrick Schulmann	1987	Feature	French	France		Murder mystery comedy about a serial killer who cuts off his victims' ears and places them between their teeth; members of the Deaf Community quickly become suspects; secondary deaf actors are played by Paris IVT (International Visual Theatre) actors	comedy; crime/mystery; deaf victim/witness; deaf villain/suspect	
	Les Poings fermés	Jean-Louis Benoît	1984	Feature	French	France		During WWII, a young boy is sent to live with a religious Lutheran woman, her deaf daughter and traumatised, murderous soldier son	adoption/foster care; deaf child; deaf victim/witness; family drama; religion; sibling relationship	
	Les Vampires	Louis Feuillade	1915	Feature	English; French	France		Early silent film about secret vampire society, including deaf character named "Father Silence"	sci-fi/fantasy	
Let Us Spell it Out for You		Joseph Santini	2007	Documentary	American Sign Language (ASL)	US		Documentary short about American Sign Language (ASL) protest against funding cuts to theatre programs	Deaf Culture; all/most dialogue in sign language	
Lexie Cannes		Tom Bertling	2009	Feature	American Sign Language (ASL); English	US		Thriller in which deaf woman is stalked by hearing man	deaf victim/witness; hearing stalker/killer	
Lightning Jack		Simon Wincer	1994	Feature	English	US		Australia-set crass comedy western in which Cuba Gooding Jr. plays a hearing nonverbal man trying to make it big on his last heist	comedy; nonverbal; western	
Like Water for Chocolate	Como agua para chocolate	Alfonso Arau	1992	Feature	English; Spanish	Mexico		Romance in which a woman forbidden from marrying her love channels her passion into cooking. Includes deaf cook character	romance	
Lilo & Stitch: The Series		Victor Cook; Mike Girard	2003	Children's series	English	US		In season 1 episode 18 ("Yaarp: Experiment 613") of this Disney spin-off series, Lilo accidentally sets off an explosion that temporarily deafens him (series duration 2003-6)	deafened by accident/violence; temporarily deafened	
The Linguini Incident		Richard Shepard	1991	Feature	English	US		Crime-comedy with David Bowie and Rosanna Arquette includes deaf character	comedy; crime/mystery	
Lisandre et ses frères		Rafaèle Layani	2003	Short	French; French Sign Language (LSF)	France		Short about a family that communicates in French Sign Language (LSF)	deaf child; deaf child hearing parent; family drama; sibling relationship	
Listen		Kimby Caplan	2004	Documentary	English	US		Documentary short about family's "struggle" to get deaf daughter to speak	deaf child; deaf child hearing parent; family drama; learning speech; oralism (repression of sign)	
Listen to the Hands of Our People		Jade Bryan	1994	Documentary	American Sign Language (ASL); English	US		Documentary about the lives of seven HIV+ deaf people	accessibility; Deaf Culture; disability; queer	
Little Bird of Happiness	Parandeyeh koochake khoshbakhti	Pouran Derakhshandeh	1988	Feature	Farsi	Iran		A young girl is temporarily deafened by the trauma of witnessing her mother's death; she goes to a School for the Deaf and learns sign, but as a psychologist helps her work through her trauma, her deafness is 'cured'	adapting to deafness; adoption/foster care; deaf child; deaf child hearing parent; deafened by accident/violence; deafness 'cured'; grief; 'hearing saviour'; learning sign; School for the Deaf; school/university setting	
Little House on the Prairie		Maury Dexter	1980	Children's series	American Sign Language (ASL); English	US		In season 6 episode 17 ("Silent Promises") of this pastoral children's western, Laura takes a job tutoring a young deaf boy who develops a crush on her (series duration 1974-83)	deaf child; hearing teacher; learning sign; romance	
The Lives and Loves of Beethoven	Un grand amour de Beethoven	Abel Gance	1936	Feature	French	France		Biopic of Beethoven which emphasises the drama of Beethoven's acquired deafness, including in his romantic relationships	Beethoven; biopic; deaf musician/dancer; drama; music	
Living with Fran		Barnet Kellman	2005	Series	English	US		Season 2 episode 2 ("Going to a Bar Mitzvah with Fran") of this Fran Drescher rom com series includes secondary character played by deaf actor Amanda McDonough (series duration 2005-7)	comedy; deaf actor; romantic comedy	
Lon Chaney: A Thousand Faces		Kevin Brownlow	2000	Feature	English	US		Documentary about Lon Chaney (hearing, signing silent film actor who was a Coda and Soda)	Coda; Deaf Gain; deaf-hearing relationship	
Looking for Mr. Goodbar		Richard Brooks	1977	Feature	English	US		Crime drama in which Diane Keaton's character is teacher to deaf children (played by deaf actors)	crime/mystery; deaf actor; deaf child; drama; hearing teacher; learning sign; school/university setting	
Love and Deaf		Adam Baran	2004	Short	American Sign Language (ASL); English	US		Hearing man talks to listening deaf man in bathroom, falls in love	deaf character inspires hearing character's self-actualisation; deaf-hearing relationship; queer; romance	
Love & Pop		Hideaki Anno	1998	Feature	Japanese; Japanese Sign Language (JSL)	Japan		Drama about high school girl trying to buy expensive ring, includes dialogue in Japanese Sign Language (JSL)	drama	
Love Happens		Brandon Camp	2009	Feature	American Sign Language (ASL); English	US		Romance in which grieving widower (Aaron Eckhart) falls for florist (Jennifer Aniston), includes passages in sign language	drama; grief; romance	
Love in Another Language	Baska Dilde Ask	Ilksen Basarir	2009	Feature	Turkish; Turkish Sign Language (TİD)	Turkey		Neglected deaf man works as a librarian and despite being verbal, chooses not to speak due to discrimination against his deaf accent	isolation; oralism (repression of sign)	
Love is Deaf		Andrew Kenneth Gay	2005	Short	American Sign Language (ASL); English	US		A short of an American Sign Language (ASL) conversation between hearing man and deaf woman	deaf-hearing relationship	
Love is Never Silent		Joseph Sargent	1985	Feature	American Sign Language (ASL); English	US		Hallmark movie adaptation of Joanne Greenberg's novel, In This Sign, about a Coda girl and her Deaf parents	Coda; deaf-hearing relationship; family drama	
MacGyver		James L. Conway	1986	Series	English; Greek	Canada; US		In season 2 episode 9 ("Silent World") of this action series, MacGyver helps his friend, who is a teacher of the Deaf, with his revealing nightmares (series duration 1985-92)	friendship; hearing teacher; learning sign; School for the Deaf; school/university setting	
Mad Max		George Miller	1979	Feature	Australian Sign Language (Auslan); English	Australia		In idyllic flashbacks in this postapocalyptic action horror, Max's wife Jessie signs "I'm crazy about you" to him	action; apocalypse; survival narrative	
Madhouse	And When She Was Bad	Ovidio G. Assonitis	1981	Feature	English	Italy		Horror in which woman is pursued by her murderous sister, includes deaf girl character	family drama; hearing stalker/killer; horror; sibling relationship	
Madagascar		Eric Darnell and Tom McGrath	2005	Children's feature	American Sign Language (ASL); English	US	Netflix	Monkey characters sign in actual American Sign Language (ASL)	comedy; signing animal	
