English Title	Original Title	Director/Creator	Year	Format	Languages	Countries	Platforms	Summary	Tags	IMDb Tag Number
Love Sounds Like		Jemma Kuchel	2023	Short	Australian Sign Language (Auslan); English	Australia		Romance short about a deaf man (Todd Kenny) and a hearing woman	deaf actor; deaf-hearing relationship; drama; romance	
Love's Portrait		John Lyde	2022	Feature	English; Irish Sign Language (ISL)	US		Hallmark-style romance movie includes hearing American woman who goes to Ireland and understands deaf woman	drama; romance	
The Loved Ones		Martina Bell	2013	Short	American Sign Language (ASL); English	US		Kidnapping short includes several deaf characters kept hostage in a garage	crime/mystery; deaf actor; deaf director; deaf victim/witness; deaf writer/producer; horror	
	Maalaala Mo Kaya	Lino S. Cayetano	2010-18	Series	Filipino; Filipino Sign Language (FSL)	Philippines		Episode 829 ("T-Shirt" 2010) of the longest-running Filipino drama anthology is about the son of a deaf mother. Episode 1,044 ("Kamay" 2015)  is about deaf woman Christine, a Miss World Philippines pageant candidate. Episode 1,231 ("Drawing" 2018) about a deaf boy who loves expressing himself through drawing, meanwhile his mother starts to learn sign (series duration 1991-)	Coda; deaf-hearing relationship; drama; family drama	
	Mabina Moboko: La danse des mains	André St-Pierre	2013	Documentary	French	Canada		Documentary about the Deaf community in Kinshasa	Deaf Culture	
Madagascar: A Little Wild		Dana Starfield	2020-2	Children's series	American Sign Language (ASL); English	Canada; US	Stan	Children's series about animals features an animated deaf character who signs in American Sign Language (ASL)	signing animal	
Magic Hands		Cbeebies	2013-	Children's series	British Sign Language (BSL)	UK		Children's series features poetry performed in British Sign Language (BSL)	all/most dialogue in sign language; sign language poetry/song	
The Magicians		Sera Gamble; John McNamara	2015-20	Series	American Sign Language (ASL); English	US	 	Fantasy series which features deaf actor Marlee Matlin in eight episodes (across seasons 2, 3 and 4)	deaf actor	
Magpakailanman	"Prinsesa ng mga pipi"	Neal Del Rosario	2013	Series	Filipino; Filipino Sign Language (FSL); Tagalog	Philippines		Season 1 episode 42 ("The Princess Pura Story") of this drama anthology, episode is about a deaf girl who becomes a beauty queen (series duration 2012-)	deaf contestant	
Making Xmile 2: Cine para todos		Mighel Angel Font Bisier	2018	Documentary	Spanish	Spain		Making-of documentary short about accessible project for deaf, blind and deafblind audiences	accessibility; deafblind documentary; disability	
Manhole	Maen-hol	Jae-Young Shin	2014	Feature	Korean; Korean Sign Language (KSL)	Korea		Thriller about serial killer who operates out of manholes, includes one deaf girl victim	deaf victim/witness; hearing stalker/killer	
The Mandalorian		Jon Favreau	2019	Series	English; invented sign language	US	Disney+	Sci-fi fantasy spin-off from the Star Wars universe includes the Indigenous Tusken Raider community who communicate in a sign language invented and performed by Troy Kotsur	deaf actor; Deaf Culture; deaf writer/producer	
Marchlands		James Kent	2011	Series	English	UK		Supernatural house series features deaf actor Sophie Stone as supporting character Olive	deaf actor	
Marie's Story	Marie Heurtin	Jean-Pierre Ameris	2014	Feature	French; French Sign Language (LSF)	France		C19th period drama in which a deafblind girl (deaf actor Ariana Rivoire) is educated in French Sign Language (LSF) by a hearing nun in School for the Deaf	deaf actor; deaf child; deaf child hearing parent; deafblind character; hearing teacher; 'hearing saviour'; learning sign; religion; School for the Deaf; school/university setting	
Marguerite		Xavier Giannoli	2015	Feature	French; English; Italian	Belgium; Czech Republic; France	 	Comedy drama about the famously 'awful' singer Marguerite Dumont, based on real-life Florence Foster Jenkins, who was partially deafened by syphilis	biopic; comedy; deaf musician/dancer; deafened by illness; drama; music	
Marlee Matlin: Not Alone Anymore		Shoshannah Stern	2025	Documentary	American Sign Language (ASL); English	US		Feature-length documentary about Deaf actor, producer and director Marlee Matlin, the first Deaf Oscar winner, directed by Deaf actor, writer and director Shoshannah Stern	accessibility; deaf actor; Deaf Culture; deaf director; Deaf Gain; deaf writer/producer; oralism (repression of sign)	
Master of None		Aziz Ansari; Alan Yang	2015-2021	Series	American Sign Language (ASL); English	US	Netflix	Season 2 episode 6 (2017) of this drama series focuses on a bodega worker, Maya, played by deaf actor Treshelle Edmond, including following her day from her perspective	accessibility; deaf actor; drama; friendship	
Maurice's Symphony		Andrei Gostin; Alexander Nakone	2017	Feature	English	Australia		Brilliant young flutist 'overcomes' his deafening in an industrial accident	deaf musician/dancer; deafened by accident/violence; deafness 'cured'; music	
Mea Maxima Culpa: Silence in the House of God	 	Alex Gibney	2012	Documentary	English	US		HBO documentary about clerical sex abuse allegations by four men working in a School for the Deaf	deaf child; deaf victim/witness; deaf villain/suspect; religion; School for the Deaf	
	La Mécanique du silence	Brigitte Lemaine	2011	Documentary	French; French Sign Language (LSF)	France		Documentary short about a group of deaf students' visit to deafblind artist Petit Pierre's famous Carousel artwork	deaf artist; deafblind documentary; 	
Medeas		Andrea Pallaoro	2013	Feature	English	Italy; Mexico; US		Drama about a farming family with hearing father and deaf mother	Coda; deaf-hearing relationship; family drama	
Memories of the Warsaw Ghetto		Alexander Genievsky	2016	Documentary	American Sign Language (ASL); English	US		WWII documentary which lists American Sign Language (ASL) on IMDb (more details needed)		
Mermaid Down		Jeffery Grellman	2019	Feature	English; invented sign language	US		Fantasy horror in which a mermaid is abducted, has her tail removed and is locked in a mental institution where she is not believed. The mermaids cannot speak but communicate in their own sign language	horror; nonverbal	
Miami Medical		Danny Cannon	2010	Series	English	US		In season 1 episode 4 ("All Fall Down") of this medical drama, Ryan Lane plays a deaf patient having a panic attack who is initially misperceived as a hearing person having a seizure	deaf actor; medical drama	
Middle Man		Charlie Francis	2014	Short	English	US		Short in which a sign language phone relayer interprets a fight between a couple	drama; romance	
Midnight		Oh-Seung Kwon	2021	Feature	Korean; Korean Sign Language (KSL)	South Korea	SBS On Demand	Seoul serial killer hunts a deaf woman (who works as a sign language operator in a call centre) who witnessed him attempt a murder. Many of the cat-and-mouse scenes centre on her use of silence and devices to increase her observance of her surroundings	deaf victim/witness; hearing stalker/killer	
Milano		Christina Vandekerckhove	2024	Feature	Flemish Sign Language (VGT); Flemish; French	Belgium		A hearing father and his deaf son (Basil Wheatley), who use sign at home, live separately from his addicted mother. The film explores their complex relationship and the father's dangerous work growing and dealing marijuana. Uses American Sign Language (ASL) despite its Belgian setting, to increase viewer comprehension	born deaf; deaf actor; deaf child; deaf child hearing parent; deaf-hearing relationship; family drama	
Miles in Love		Martina Bell	2018	Short	American Sign Language (ASL)	US		ASL drama short about a deaf man's dramatic night, including the possibility of romance, includes deaf actors Eddie Buck and Martina Bell	deaf actor; deaf director; romance; thriller	
Millstone		Peter Hoffman Kimball	2023	Short	American Sign Language (ASL)	US		American Sign Language (ASL)-only film about a married couple grieving the death of their child with new therapy, includes deaf actors Daniel Durant and Eddie Buck	Coda; deaf actor; all/most dialogue in sign language; grief	
Minx		Carrie Brownstein	2022	Series	American Sign Language (ASL); English	US		In the "Mary Had a Little Hysterectomy" episode of this comedy drama series the main character goes to a deaf feminist meeting group, communicates in American Sign Language (ASL)	comedy	
Mommy		Xavier Dolan	2014	Feature	French	Canada		A nonverbal neighbour decides to help a widow and her disregulated son; she has recently become nonverbal due to unexplained trauma	family drama; nonverbal	
Monster: The Jeffrey Dahmer Story		Ryan Murphy; Ian Brennan	2022	Series	English	US	Netflix	Limited series about Jeffrey Dahmer and his victims, includes a Deaf Culture-informed episode from the perspective of deaf victim/witness Tony Hughes (deaf actor Rodney Burford)	deaf actor; horror; survival narrative	
Moonlight Sonata: Deafness in Three Movements	 	Irene Taylor Brodsky	2019	Feature	English	US		HBO story about a deaf boy and his deaf grandfather, interlaced with Beethoven's experience going deaf	Beethoven; deaf child; deaf musician/dancer; drama; family drama; music	
Mother. In the Name of Millions		Vyacheslav Bihun	2014	Short		Estonia; Ukraine		Dialogue-free short about a man's mother who goes deaf	family drama; progressive hearing loss	
Mourning	Soog	Morteza Farshbaf	2011	Feature	Farsi; Iranian Sign Language (ISL)	Iran		Deaf couple take on care of their nephew when his parents are killed	adoption/foster care; Coda; drama; family drama; grief	
Multiverse	Entangled	Gaurav Seth	2019	Feature	American Sign Language (ASL); English	Canada		Sci-fi thriller containing several deaf actors including Sandra May Frank and Marlee Matlin	deaf actor; sci-fi/fantasy	
Mum		Alex Bohs	2013	Short	English	US		Short about a boy's healing in the wake of an accident	deaf child; deafened by accident/violence; deafness 'cured'	
Murdoch Mysteries		Laurie Lynd	2017	Series	English	Canada		Season 11 episode 3 ("8 Footsteps") of this crime drama is about a murder at a Helen Keller dinner of honour, solved using an Alexander Graham Bell recording device (series duration 2008-)	Alexander Graham Bell; crime/mystery; drama; Helen Keller	
Mute		Duncan Jones	2018	Feature	English; German	Germany; UK	Netflix	Nonverbal hearing signing bartender in dystopian near-future Berlin. Tagline: 'He doesn't need words'	nonverbal	
The Mute Man of Sardinia	Il Muto di Gallura	Matteo Fresi	2021	Feature	Italian; Sardinian	Italy		Based on a true story about a mistreated deaf man who becomes an assassin in C19th Italy	crime/mystery; deaf victim/witness; deaf villain/suspect; hearing actor in deaf role	
My Brother is Deaf		Peter Hoffman Kimball	2022	Short	English	US		Family documentary short about a hearing boy whose brother is born deaf	born deaf; deaf child; learning sign; sibling relationship	
My Darling Christopher		Clare-Louise English	2020	Short	British Sign Language (BSL); English	UK		Short about a boy who contracts meningitis and loses sight and hearing at start of WWII, includes deaf actors Brian Duffy and William Grint	deaf actor; deaf director; deafened by illness	
My Dead Ex		Jason Director; Drew Hancock; Ayla Harrison	2018	Series	American Sign Language (ASL); English	US		One-season high school comedy about a girl falling in love with a dead boy, includes several deaf actors such as Martina Bell and Ryan Lane	comedy; deaf actor; deaf-hearing relationship; romance; school/university setting	
My Father Die		Sean Brosnan	2016	Feature	American Sign Language (ASL); English	US		Action thriller features vengeance enacted by a deaf brother	action; revenge/vigilante; sibling relationship; thriller	
My Little Brother		Ma Dae-yun	2017	Feature	Korean; Korean Sign Language (KSL)	South Korea		Family comedy about long-lost half-brother, includes deaf signing character	comedy; sibling relationship	
My Lovely Angel	Naegen namu sojunghan neo	Sung-Mo Kwon; Chang-Won Lee	2021	Feature	Korean	South Korea		Lonely man adopts deafblind child, film traces their mutual learning about life	adoption/foster care; deaf child; deafblind character; isolation; learning sign	
My Salinger Year		Philippe Falardeau	2020	Feature	English	Canada; Ireland		Story about J.D. Salinger's secretary; she speaks with the partially deaf Salinger on the phone, who yells	progressive hearing loss	
My Song		William Mager	2011	Short	British Sign Language (BSL); English	UK		Short about deaf girl caught between deaf and hearing worlds	deaf-hearing relationship	
My Summer in Provence	Avis de mistral	Rose Bosch	2014	Feature	English; French; French Sign Language (LSF)	France		Three grandchildren, the youngest of whom is deaf, meet their grandfather for the first time at his home in Provence	family drama	
My World	Benim Dünyam	Ugur Yücel	2013	Feature	Turkish; Turkish Sign Language (TİD)	Turkey		A Turkish family's challenges with their deafblind daughter	deaf child hearing parent; deafblind character; family drama	
Nailed It!		Paul Starkman	2018	Series	English	US		Season 1 episode 4 ("Weird Science") of this reality comedy baking show includes deaf contestant Megan Swanson (series duration 2018-)	comedy; deaf contestant; reality tv	
Name Me Lawand		Edward Lovelace	2022	Documentary	British Sign Language (BSL); English; Kurdish; Kurdish Sign Language (ZHK)	UK		Documentary about a young deaf Kurdish boy's migration, language learning and integration into British Deaf Culture	deaf child; deaf child hearing parent; Deaf Culture; isolation; School for the Deaf; school/university setting	
Neighbours			1985-2022	Series	Australian Sign Language (Auslan); English	Australia		Final year of the 40-year show (2021-22) includes two deaf characters: teacher Curtis (Nathan Borg) who's had a cochlear implant since childhood, and older lady Shannon who is looking into hearing aids and is mentored by Curtis	cochlear implant; deaf actor; drama; hearing aid; progressive hearing loss	
Never Give Up		Rob Loos	2023	Feature	American Sign Language (ASL); English	US	 	Biopic about deaf tennis champion Brad Minns at the 1985 Deaf World Games	biopic; deaf sporting excellence; drama; sports	
New Amsterdam			2018-	Series	American Sign Language (ASL); English	US		Season 1 episode 19 of this medical drama features Lauren Ridloff. Season 3 (2020) also briefly features John P. McGinty as doctor and season 4 (2021) includes deaf surgeon played by Sandra Mae Frank	deaf actor; deaf scientist/medical professional; drama; medical drama	
The New Normal:		Ryan Murphy	2012	Serid	English	US		Pilot for a series about the surrogate for a gay couple, including a deaf mom character played by deaf actor Antoinette Abbamonte	adoption/foster care; Coda; deaf actor; queer	
Nice Talking to You 		Saim Sadiq	2018	Short	American Sign Language (ASL); Arabic; English	US		Multilingual short in which two deaf people make a connection in NYC	drama; sign language poetry/song	
The Night of the 12th	La Nuit du 12	Dominik Moll	2022	Feature	French; French Sign Language (LSF)	Belgium; France	 	Murder crime mystery includes significant scene in French Sign Language (LSF)	crime/mystery	
No Ordinary Hero: The Super Deafy Movie		Troy Kotsur	2013	Feature	American Sign Language (ASL); English	US		Deaf actor (John Maucere) portrays 'SuperDeafy' superhero on television, wants to help deaf child Jacob (Zane Hencker)	deaf actor; deaf child; deaf director; deaf superhero; deaf writer/producer	
Noelle		Marc Lawrence	2019	Children's feature	American Sign Language (ASL); English	US	Disney+	Disney Christmas film in which Santa's daughter, Noelle, discovers she's his heir when she can understand the languages all children communicate with her in; this is revealed when she naturally signs in American Sign Language (ASL) with deaf child (Shaylee Mansfield)	deaf actor; deaf child; learning sign	
Noise		Jeremy Laval	2019	Feature	French	France		Man deafened by accident/violence starts to hear people's thoughts and to solve crimes	crime/mystery; Deaf Gain; deafened by accident/violence	
Noor		Guillaume Giovanetti; Cagla Zencirci	2012	Feature	Punjabi; Urdu	France; Pakistan		Transgender Pakistani woman's journey, includes reference to deaf character	drama; queer	
The Novelist's Film	So-seol-ga-ui yeong-hwa	Hong Sang-soo	2022	Feature	Korean; Korean Sign Language (KSL)	South Korea		A novelist visits a friend at their bookstore; includes passages in Korean Sign Language (KSL)	drama; friendship	
Novitiate		Maggie Betts	2017	Feature	American Sign Language (ASL); English; Latin	US		Vatican sexual discrimination drama about a nun, IMDb lists American Sign Language (ASL); more details needed	drama; religion	
Number 5		Emiliano Gómez	2017	Short	Spanish	Paraguay		Short about a deafblind woman and her hearing brother discovering her appreciation of music	deafblind character; family drama; music; sibling relationship; vibrations	
The Offer		Leslie Greif; Michael Tolkin	2022	Series	English	US		Fictionalised mini-series based on the making of 1972's The Godfather includes Lou Ferrigno as Lenny Montana (Luca Brasi actor), in his first role after receiving cochlear implants	deaf actor	
On Beat		Reid Davenport; Cheng Zhang	2015	Short	American Sign Language (ASL); English	US		Hearing parents and deaf children bond over the beat of music	deaf child; deaf child hearing parents; family drama; music; vibrations	
One Day That Changed My Life		Meyrick Cook; Jimmy Dallas; Tom Dalzell	2019	Documentary	British Sign Language (BSL); English	UK		Season 2 episode 6 of this documentary series about pivotal days in people's lives is about deaf woman Nelema passing her driver's test (series duration 2018-19)	accessibility	
Only I Can Hear		Itaru Matsui and Heath Cozens	2021	Short	American Sign Language (ASL); English; Japanese	Canada; Japan		Three hearing teenagers come of age in a Midwest Deaf community	Coda; Deaf Culture; deaf-hearing relationship	
Only Murders in the Building		John Hoffman; Steve Martin	2021	Series	American Sign Language (ASL); English; Spanish	US	Disney+	Murder mystery comedy series with Selena Gomez, Steve Martin and Martin Sheen includes a hearing father and Deaf son (Theo, played by James Caverley) criminal duo who work as grave robbers	crime/mystery; deaf actor; deaf child hearing parent; deaf villain/suspect; deaf-hearing relationship	
The Ornithologist	O Ornitólogo	João Pedro Rodrigues	2016	Feature	English; Latin; Mandarin; Mandarin; Portuguese; Portuguese Sign Language (LGP)	Brazil; France; Portugal		A mystic quest in which an ornithologist meets a series of tests and figures he must pass, including a deaf man	sci-fi/fantasy	
Our Deaf Ways		Paula Thornton	2022	Documentary	Auslan	Australia		Video podcast' series about Deaf Culture, news language and life in several episodes from Australian broadcaster SBS 	accessibility; Deaf Culture; all/most dialogue in sign language; learning sign	
Outlander		Anna Foerster	2014	Serid	English; invented sign language; Scots	US		Season 1 episode 8 of this Scots time travel fantasy includes a hearing character who communicates in sign because his tongue has been cut out. Season 5 episode 3 also includes some sign (series duration 2014-)	nonverbal; sci-fi/fantasy	
Outsider: The Life and Art of Judith Scott		Betsy Bayha	2006	Documentary	American Sign Language (ASL); English	US		Documentary short about artist Judith Scott, who is deaf and has Down's Syndrome	accessibility; deaf artist; disability	
	Palabras de Caramelo	Juan Antonio Moreno Amador	2016	Short	Francophone African Sign Language (LSAF)	Spain		Young deaf boy in a Sahara refugee camp wants to learn to write to translate the words of his best friend, a camel named Caramelo	deaf child; friendship	
The Palawan Script	Baybayin	Auraeus Solito	2012	Feature	Filipino	Philippines		Two sisters fall in love with the same deaf man who they cannot yet communicate with	deaf-hearing relationship; drama; family drama; learning sign; romance; sibling relationship	
The Parts You Lose		Christopher Cantwell	2019	Feature	English	Canada; US		Friendship between a hearing criminal on the run and a young, bullied deaf boy who shelters him in his family's barn	crime/mystery; deaf actor; deaf child; deaf child hearing parent; deaf victim/witness; friendship	
	Pas le choix	Hrysto	2022	Feature	French; French Sign Language (LSF)	France		All Deaf-led cabaret-style short about a murder mystery includes fantastical mixing of French and French Sign Language (LSF) in which all characters naturally understand each other despite not knowing each other's language	crime/mystery; deaf actor; deaf director; deaf writer/producer; deaf victim/witness; deaf villain/suspect; queer; romance	
Passengers		Dickie Hearts	2015	Short	American Sign Language (ASL); English	US		Deaf-led road trip comedy short, includes deaf actors Amanda McDonough, Josh Castille and Miles Barbee	deaf actor; deaf director; deaf writer/producer	
The Pastman		Charlie Ainsworth	2018	Short	American Sign Language (ASL)	US		ASL short about time travel and time travel criminals in hiding, includes deaf actors Russell Harvard and Sandra Mae Frank	deaf actor; deaf director; deaf writer/producer	
People Magazine Investigates		Stephan Schuster	2019	Documentary	American Sign Language (ASL); English	US		True crime documentary with reenactments about the year 2000 murderes at Gallaudet University	crime/mystery; deaf actor; school/university setting	
People of the Eye		Martina Bell	2019	Short	American Sign Language (ASL)	US		ASL sci-fi short with mostly-Deaf cast	deaf actor; deaf director; deaf writer/producer; all/most dialogue in sign language; sci-fi/fantasy	
Perfect Sense		David Mackenzie	2011	Feature	British Sign Language (BSL); English	Denmark; Ireland; Sweden; UK		Erotic drama starring Ewan McGregor and Eva Green during an epidemic that destroys the senses	deafened by illness; drama	
The Perfect Wedding		Scott Gabriel	2012	Feature	English	US		Gay wedding romantic comedy includes a deaf family member	queer; romantic comedy	
Perfection		Kimberly Chou	2017	Short	American Sign Language (ASL); English	US		Short in which painter witnesses two deaf gallery guests (Eddie Buck and Megan Clancy) viewing his work	deaf actor; drama	
Petroleum Spirit	Crash Burn Love	Rob Sanders	2015	Feature	English	UK		Dark thriller in which a young, hard of hearing man sets out to find his father after the death of his mother	crime/mystery; deaf child hearing parent; grief; isolation	
The Photo		Marcus Greco	2020	Short	English	US		Deaf-led romance short in which a man pines for his girlfriend while staring at a photo, includes deaf actors Dani Duran and Eddie Buck	deaf actor; deaf director; deaf writer/producer; romance	
Pittsburgh		Rory Dering	2013	Short	American Sign Language (ASL); English	US		Short about conversations on relationships between deaf and hearing gay partners	deaf-hearing relationship; queer; romance	
Planet of Snail	Dalpaengee eui byeol	Seung-jun Yi	2011	Feature	Korean; Korean Sign Language (KSL)	Finland; Japan; South Korea		Deafblind man (Cho Young-Chan) struggles to communicate with those around him until he shares tactile sign language with a disabled woman	accessibility; deafblind documentary; disability; learning sign	
Plus One		Duncan Ragg	2024	Short	Australian Sign Language (Auslan); English	Australia		Comedy short about a man determined to throw the perfect house party	comedy	
The Politician		Ian Brennan; Brad Falchuk; Ryan Murphy	2019-	Series	American Sign Language (ASL); English	US	Netflix	High school politics dramedy includes Deaf actor Natasha Ofili in four episodes	deaf actor; school/university setting	
Portals		Steve Helgoth	2021	Short	English	US		Sci-fi portal short includes Josh Castille in supporting role	deaf actor; sci-fi/fantasy	
Power in Our Hands		Angela Spielspinger	2016	Documentary	British Sign Language (BSL); English	UK		Documentary about activism in the British Deaf Community	accessibility; Deaf Culture	
Preman		Randolph Zaini	2021	Feature	Indonesian; English 	Indonesia		An action about a deaf father protecting his son against crime associates after his son witnessed a murder. 	action; crime/mystery	tt10011002
Press Mute to See		Harry Pages	2016	Short	British Sign Language (BSL); English	UK		Short in which a deaf woman busks on the street	deaf artist	
Project Nim		James Marsh	2011	Documentary	American Sign Language (ASL); English	UK; US		Documentary about Nim, the famous chimpanzee trained by a New York family to sign in the 1970s	signing animal	
Project Runway		Eli Holzman	2004-	Series	American Sign Language (ASL); English	US		This popular fashion contest series featured deaf designer Justin LeBlanc as a contestant in season 12 (2013). Justin had an American Sign Language (ASL) interpreter present throughout his participation in the series	accessibility; deaf artist; deaf contestant; Deaf Gain; reality tv	
Project Runway All Stars		Eli Holzman	2012-2019	Series	American Sign Language (ASL); English	US		Spinoff of the fashion design contest featuring popular winners included deaf contestant Justin LeBlanc in season 4 (2014). Justin had an American Sign Language (ASL) interpreter present throughout his participation in the series	accessibility; deaf artist; deaf contestant; Deaf Gain; reality tv	
Punk Chef			2013	Series	British Sign Language (BSL)	UK		British Sign Language (BSL) cooking show in which 'Punk Chef' teaches British deaf people to 'eat healthier'	all/most dialogue in sign language; reality tv	
Puss in Boots in German Sign Language	Die gestiefelte Katze in deutscher Gebärdensprache	Britt Dunse	2021	Children's short	German Sign Language (DGS)	Germany		Children's German Sign Language animated rendition of the fairy tale Puss in Boots	all/most dialogue in sign language	
