English Title	Original Title	Director/Creator	Year	Format	Languages	Countries	Platforms	Summary	Tags	IMDb Tag Number
Babel		Alejandro Inarritu	2006	Feature	Arabic; Berber Languages; English; French; Japanese; Japanese Sign Language (JSL); Russian; Spanish	France; Japan; Mexico; Morocco; US		Portmanteau film about transcultural isolation includes section with lonely deaf teen Japanese girl	deaf child; deaf child hearing parent; hearing actor in deaf role; isolation	
The Baby-Sitters Club		Lynn Hamrick	1990	Children's series	American Sign Language (ASL); English	US		In season 1 episode 9 ("Jessi and the Mystery of the Stolen Secrets") of this children's babysitting drama, Jessi learns sign language to communicate with deaf boy (series duration 1990)	crime/mystery; deaf child; deaf-hearing relationship; learning sign	
The Bachelor's Swan Song	Zai jian wang lao wu	Tung-Shing Yee	1989	Feature	Cantonese; Hong Kong Sign Language (HKSL)	Hong Kong		Engaged couple lose their money just as they plan a shotgun wedding; includes scenes signing with deaf side character	drama; romance	
Back to Bombay		Rosa Rogers	2006	Documentary	British Sign Language (BSL); English; Hindi; Indian Sign Language (ISL)	US		A young deaf woman travels from her UK home to her birthplace in India to see the family she was taken from in childhood	adoption/foster care	
Badlands		Terrence Malick	1973	Feature	English; Spanish	US		Teen killer drama set in the 1950s includes deaf maid side character who they spare	crime/mystery; deaf servant; drama	
Balles perdues		Jean-Louis Comolli	1982	Feature	French; French Sign Language (LSF)	France		Slapstick comedy about a jewel thief and assassination with motley group of suspects including a deaf artist	comedy; crime/mystery; deaf artist; deaf villain/suspect	
Bang Bang		Andrea Tonacci	1971	Feature	Portuguese	Brazil		Cult Brazilian underground film about a narcissistic man who has a deafblind brother	comedy; deafblind character; sibling relationship	
Bangkok Dangerous		Danny Pang; Oxide Chun Pang	2000	Feature	Thai	Thailand		Action film about a deaf hitman and his partner in Bangkok	action; deaf villain/suspect; thriller	
Bangkok Dangerous		Danny Pang; Oxide Chun Pang	2008	Feature	English; Thai	Czech Republic; Thailand; US	Stan	US remake of Thai original (original with deaf protagonist, remake replaces makes Nicolas Cage the protagonist and shifts the deaf character to side role)	action; deaf villain/suspect; thriller	
Barney Miller		Noam Pitlik	1981	Series	American Sign Language (ASL); English	US		Season 7 episode 12 ("Stormy Weather") of this crime drama series includes a deaf woman arrested for sex work (series duration 1975-82)	crime/mystery; drama; sex work	
Be With Me		Eric Khoo	2005	Feature	Cantonese; English; Hokkien; Mandarin	Singapore		Lonely widower connects with a deafblind woman played by deafblind actor Theresa Chan	deaf-hearing relationship; deafblind character; drama; grief; isolation	
Beau Bandit		Lambert Hillyer	1930	Feature	English	US		Western in which hearing and deaf bandits are pursued by bounty hunters	deaf villain/suspect; hearing actor in deaf role; western	
Beauty and the Beast		Christopher Leitch	1987	Series	American Sign Language (ASL); English; Greek	US		This romantic crime drama about a hybrid lion-man and his relationship with a NYC lawyer includes an episode (season 1 episode 11) in which a young deaf girl who lives in the tunnels under the city witnesses a murder and must exit her safe space to provide testimony to safe an innocent man	crime/mystery; deaf child; deaf victim/witness; wild child	
Becoming Jane		Julian Jarrold	2007	Feature	British Sign Language (BSL); English	Ireland; UK		Anne Hathaway Jane Austen biopic includes scenes in British Sign Language (BSL) with Jane's deaf brother George	biopic; deaf child hearing parent; drama; family drama; sibling relationship	
Beethoven		Francesca Kemp; Ursula Macfarlane; Damon Thomas	2005	Series	English	UK		BBC mini-series in the form of a dramatised documentary about Beethoven's life	adapting to deafness; Beethoven; deaf musician/dancer; deafened by illness; drama; progressive hearing loss	
Beethoven's Great Love	Un grand amour de Beethoven	Abel Gance	1936	Feature	French	France		Early cinema Beethoven biopic	Beethoven; biopic; deaf musician/dancer; drama; music	
Beethoven Lives Upstairs		David Devine	1992	Feature	English	Canada		Young boy discovers the eccentric man living upstairs is Beethoven	Beethoven; biopic; deaf musician/dancer; drama; music	
Beethoven's Nephew	Le neveu de Beethoven	Paul Morrissey	1985	Feature	English	France; West Germany		Drama in which Beethoven's surviving nephew reflects on his turbulent relationship with his uncle	Beethoven; biopic; deaf musician/dancer; family drama	
Bewogen		Anja Hiddinga; Leendert Pot	2004	Short	Dutch Sign Language (NGT)	Netherlands		Short featuring five poems in Dutch Sign Language (NGT)	all/most dialogue in sign language; sign language poetry/song	
Beyond Silence	Jenseits der Stille	Caroline Link	1996	Feature	English; German; German Sign Language (DGS); Spanish	Germany		Young Coda girl who often interprets for her family receives a clarinet as a gift and discovers her passion for music, includes deaf actor Emmanuelle Laborit	Coda; deaf-hearing relationship; music	
Beyond the World	Dietro il mondo	Daniele Le Rose	2004	Feature	Italian; Italian Sign Language (LIS)	Italy		No synopsis available online, apparently mostly Deaf (more details needed)	deaf actor; deaf director; deaf writer/producer	
Big Bird's Birthday or Let Me Eat Cake		Lisa Simon; Emily Squires; Jon Stone	1991	Children's feature	English	US		Sesame Street TV movie about Big Bird's birthday includes deaf actor Linda Bove in her recurring role	deaf actor	
The Big Combo		Joseph H. Lewis	1955	Feature	English	US		Film noir in which deaf gangster who uses hearing aid is demeaned by his boss and later tortured by having his hearing aid forced to maximum volume in a loud cabaret	crime/mystery; deaf victim/witness; deaf villain/suspect; hearing aid; thriller	
Big Little Person		Robert Z. Leonard	1919	Feature	English	US		Tragic romance in which a school teacher loses much of her hearing due to scarlet fever	deafened by illness; hearing actor in deaf role; romance	
The Big Night	La Notte brava	Mauro Bolognini	1960	Feature	Italian; Italian Sign Language (LIS)	Italy		Drama about group of disillusioned youths who turn to arms dealing, includes a deaf messenger one character improvises with in sign	deaf villain/suspect; deaf victim/witness; drama	
The Big Sky		Howard Hawks	1952	Feature	Algonquin; English; French	US		Howard Hawks Western includes deaf side character	western	
Bionic Hand Implant		Amanda Everitt	2007	Short	English; New Zealand Sign Language (NZSL)	New Zealand		Short about the creation of a bionic hand that helps non-signers automatically communicate in sign	deafness 'cured'; learning sign	
Bionic Woman		Michael Dinner	2007	Series	American Sign Language (ASL)	US		American Sign Language (ASL)-only pilot that didn't get picked up about a young woman who cares for her deaf younger sister after the death of their parents	adoption/foster care; deaf child; deaf child hearing parents; deaf-hearing relationship; all/most dialogue in sign language; grief; sibling relationship	
Black		Sanjay Leela Bhansali	2005	Feature	English; Hindi	India; US		Indian deafblind woman and her teacher, based on Helen Keller biopic The Miracle Worker	deafblind character; hearing teacher; learning speech	
Black Moon Rising		Harley Cokeliss	1986	Feature	English	US		Action thriller in which man is tasked with stealing tapes from a corrupt corporation, includes deaf side character	action; crime/mystery; hearing actor in deaf role	
Black Sequence		Pierre Grimblat	1985	Series	French; French Sign Language (LSF)	France		Season 1 episode 20 of this TV movie series is about a cache of gold being hunted down by several people, including a deaf man who assists the main character	crime/mystery; deaf villain/suspect	
Blade of Satan's Bog: "The French Revolution"		Carl Théodor Dreyer	1919	Episode	Danish	Denmark		Satan appears in the form of a deaf person to denounce the Countess of Chambord to the Republican Committee during the French Revolution	deaf villain/suspect; hearing actor in deaf role; religion	
Blessings of the Land	Biyaya ng lupa	Manuel Silos	1959	Feature	Filipino; Tagalog	Philippines		Young couple run an orchard and have four children, the eldest of whom is deaf	deaf child; deaf child hearing parent; family drama; sibling relationship	
	Blinker en het Bagbag-juweel	Filip Van Neyghem	2000	Children's feature	Flemish	Belgium		Flemish children's detective show in which detective Blinker recovers an heiress's stolen jewels to be donated to a School for the Deaf	School for the Deaf	
The Blue Box		Sean Benson	2008	Short	American Sign Language (ASL)	US		Deaf woman is accused of killing her husband but cannot remember what happened	crime/mystery; deaf victim/witness; deaf villain/suspect; all/most dialogue in sign language; thriller	
Blue Heelers		Grant Brown	2005	Series	English	Australia		Season 12 episode 11 ("Mirror Image") of this Australian crime drama involves a subplot in which a deaf father kidnaps his baby (series duration 1994-2006)	Coda; deaf-hearing relationship; family drama	
Blue Rodeo		Peter Werner	1996	Feature	English	US		Woman moves to the country with her son, who was deafened in an accident	deaf child; deaf child hearing parent; deafened by accident/violence; family drama	
Blue Sky Pietro		Nigro Famulari	2009	Short	English	US		Romance short in which hearing writer boy and deaf artist girl meet up in a garden	deaf artist; deaf-hearing relationship; romance	
The Boat is Full	Das Boot Ist Voll	Marcus Imhoof	1980	Feature	French; German; Swiss German	Austria; Switzerland; West Germany		WWII drama in which a French boy must pretend to be the deaf child of fellow refugees to escape to Switzerland, but ends up betraying his hearing status	adoption/foster care; drama; hearing person pretending to be deaf	
Bodies, Rest & Motion		Michael Steinberg	1993	Feature	English	US		Road trip drama includes meeting with deaf man and his granddaughter	Coda; deaf-hearing relationship; drama; family drama	
Bodytalk		Scott Heslop	1998	Short	English	UK		Documentary short about a deaf dance group	deaf musician/dancer; music	
Bonanza		Robert Altman	1960	Series	American Sign Language (ASL); English	US		Season 2 episode 13 ("Silent Thunder") episode of this western series includes deaf girl who learns sign language from one of the hearing boy characters (series duration 1959-73)	deaf child; deaf-hearing relationship; hearing teacher; learning sign; western	
Bonne Entente		Guillaume Tion	2006	Short	French	France		Hearing singer girl and deaf boy romance, with the tagline "Unfortunately, love is only blind, not deaf"	deaf-hearing relationship; drama; music; romance	
Born To Be Wild		John Gray	1995	Feature	American Sign Language (ASL); English	US		Woman teaches gorilla to sign	learning sign; signing animal	
Born Without a Beat: The Journey of a Deaf Raver		Oliver Riley-Smith	2009	Short	British Sign Language (BSL); English	UK		Short about deaf raver who goes to the Netherlands	music; vibrations	
The Boy From Before		Owen Smith	2009	Series	British Sign Language (BSL)	UK		British Sign Language (BSL) teen series about a ghost from the 1940s	all/most dialogue in sign language	
Boy Meets Girl		Léos Carax	1984	Feature	English; French; French Sign Language (LSF)	France		Drama about homelessness includes scene in which deaf man tries to sign what's wrong with the younger generation	drama	
Bratz		Sean McNamara	2007	Children's feature	English; Spanish	US		Bratz dolls live action adaptation, one character meets deaf lipreading boy	deaf-hearing relationship; Deaf Gain; lipreading, inc. magical	
Break Up		Paul Marcus	1998	Feature	English	Canada; US		Thriller in which a deaf man telephones an abused woman	action; deaf-hearing relationship; drama; thriller	
Breaking the Silence	Piao liang ma ma	Zhou Sun	2000	Feature	Chinese Sign Language (CSL); Mandarin	China		Family drama about hearing mother and deaf son, whose father left when he found out about his son's deafness	deaf child; deaf child hearing parent; drama; family drama	
Breaking Through	After the Silence	Fred Gerber	1996	Feature	American Sign Language (ASL); English	US		A deaf girl who has grown up without sign is taught American Sign Language (ASL) by hearing social worker	hearing actor in deaf role; hearing teacher; hearing saviour; learning sign	
Bridge to Silence		Karen Arthur	1989	Feature	American Sign Language (ASL); English	US		A deaf woman has a nervous breakdown and loses custody of her daughter after her deaf husband's death in a car accident	adoption/foster care; Coda; family drama; grief	
Buffalo Dreams		David Jackson	2005	Feature	English; Plains Indian Sign Language (PISL or Hand Talk)	US		Disney TV movie about white teen boy who volunteers on a Navajo buffalo reserve, includes passages in sign language	Indigenous character/themes	
	Bukas... tatakpan ka ng dyaryo	Ruben Natividad	1991	Feature	Filipino; Tagalog	Philippines		Crime thriller includes deaf side character	crime/mystery; thriller	
	Bulung-bulungan	Susana C. de Guzman	1962	Feature	Filipino; Tagalog	Philippines		Drama without synopsis includes deaf side character (more details needed)	drama	
Bury My Heart at Wounded Knee		Yves Simoneau	2007	Feature	English; Plains Indian Sign Language (PISL or Hand Talk)	US		Western about Indigenous displacement due to North American colonisation includes passages in Indigenous sign languages	drama; Indigenous character/themes; western	
Café Seoul	Kafe souru	Masahuru Take	2009	Feature	English; Japanese; Korean	Japan; South Korea		Family lolly shop threatened by developers is helped by a journalist, includes nonverbal grandmother character	family drama; nonverbal	
Calendar Girl		John Whitesell	1993	Feature	English	US		Comedy drama includes deaf hitman character played by hearing actor; deaf community protested hearing casting	comedy; deaf villain/suspect; drama; hearing actor in deaf role	
Calling All Husbands		Noel M. Smith	1940	Feature	English	US		Rom com includes deaf judge side character	deaf lawyer; romantic comedy	
Captain Johnno		Mario Andreacchio	1988	Feature	English	Australia		Young deaf boy befriends Italian fisherman in his village; both unable to speak English, they both over communication barriers. Johnno is played by hard-of-hearing Coda Damien Walters	deaf actor; deaf child; deaf-hearing relationship; friendship	
Caravaggio		Derek Jarman	1985	Feature	English; Italian	UK		This biopic of turbulent Renaissance artist Caravaggio includes a deaf assistant side character Caravaggio has 'purchased' from the man's family	biopic; deaf servant	
Carnage	Carnages	Delphine Gleize	2002	Feature	French; Italian; Polish; Spanish	Belgium; France; Spain; Switzerland		Drama about killed rodeo bull's remains being transported throughout European countries; protagonist's parents are an intellectually disabled mother and deaf father	Coda; deaf-hearing relationship; disability; family drama	
Carry On Doctor		Gerald Thomas	1967	Feature	English	UK		Disgraced doctor comedy includes deaf woman character	comedy; medical drama	
Carter		Joey Calverly; Zilvinas Paludnevicius; Brian Suchite	2008	Short	American Sign Language (ASL)	US		A deaf man loses badly at poker and has to work out how to pay his debts	drama	
Casanova '70		Mario Monicelli	1965	Feature	Italian	Italy		Comedy in which promiscuous soldier has affair with many women, including one married to a count pretending to be deafblind	comedy; hearing character pretending to be deaf	
Casualty 			1986-	Series	British Sign Language (BSL); English	UK		This long-running British medical drama has included several deaf characters across the series history; namely Rose Ayling-Ellis, Sophie Stone and John Christiansen	deaf actor; medical drama	
CBS Schoolbreak Special		Donald Petrie	1986	Series	English	US		Season 2 episode 2 ("Have You Tried Talking to Patty?") is about a deaf teen who changes herself to try and be accepted at school (series duration 1984-96)	deaf child; drama; isolation; school/university setting	
	La Cérémonie	Claude Chabrol	1995	Feature	French; French Sign Language (LSF)	France; Germany		Post office clerk (Isabelle Huppert) convinces new maid (Sandrine Bonnaire) to rebel against her employers, includes passages in sign language	drama	
The Chain Reaction		Ian Barry	1980	Feature	English; German	Australia		Action drama includes subplot in which hearing woman falls for deaf man	action; deaf-hearing relationship; drama; romance	
Charles Krauel: A Profile of a Deaf Filmmaker		Ted Supalla	1994	Documentary	American Sign Language (ASL); English	US		A collection of Deaf documentarian Charles Krauel's (1892-1990) life's work, interspersed with interviews with Krauel about his documentation of Deaf community and culture	deaf artist; Deaf Culture; deaf director; all/most dialogue in sign language	
Charlie Chan at the Olympics		H. Bruce Humberstone	1937	Feature	English	US		Racist yellowface 'Charlie Chan' thriller includes deaf maid character	deaf servant; thriller	
Charmed		Joel J. Feigenbaum; Stewart Schill	2003	Series	English	US		In season 5 episode 20 of this magic drama series ("Sense and sense Ability"), an "Old Crone" casts a spell to render Piper blind, Phoebe deaf and Paige "mute" to steal Piper's baby (series duration 1998-2006)	deaf and blind character pairing; deafness 'cured'; drama; sci-fi/fantasy	
Cheeky Dog		Dena Curtis	2007	Short	Australian Sign Language (Auslan); English	Australia		Short about deaf boy with muscular dystrophy who loves dogs	deaf child; disability; friendship	
	Chéri-Bibi	Leon Mathot	1938	Feature	French; French Sign Language (LSF)	France		Prisoners sent to a penal colony; one deaf character helps the escape effort with sign language (which he teaches to the others because they're forbiddent to speak) but is also targeted for early death because of deafness	deaf victim/witness; sign language used for hiding/secrets	
	Chéri-Bibi	Marcel Pagliero	1954	Feature	French; French Sign Language (LSF)	France; Italy		Remake of 1932 film about soldiers in a penal colony who learn sign language from their fellow deaf prisoner to hide and escape	deaf victim/witness; sign language used for hiding/secrets	
	Chéri-Bibi	Jean Pignol	1974	Feature	French; French Sign Language (LSF)	France		TV Movie remake of 1932 film (and 1954 remake) about soldiers in a penal colony who learn sign language from their fellow deaf prisoner to hide and escape	deaf victim/witness; sign language used for hiding/secrets	
The Cherry Orchard		Michael Cacoyannis	1999	Feature	English; French	Cyprus; France; Greece		Charlotte Rampling Chekov adaptation includes deaf footman character, Fiers	deaf servant; drama	
Chicken-Pot-Pie	Vol-au-vent	Rudolf Mestdagh	1991	Short	Flemish	Belgium		Short about a deaf man who lives with his beloved chicken	friendship	
Children of a Lesser God		Randa Haines	1986	Feature	American Sign Language (ASL); English	US		Speech trainer at a School for the Deaf school falls in love with deaf janitor. Deaf actor Marlee Matlin's first film role, led to the first Oscar for a Deaf person	deaf actor; deaf child; deaf child hearing parent; drama; 'hearing saviour'; hearing teacher; learning speech; oralism (repression of sign); School for the Deaf; school/university setting	
Children of Men		Alfonso Cuarón	2006	Feature	Arabic; English; Georgian; German; Italian; Romanian; Russian; Serbian; Spanish	Japan; UK; US		Clive Owens' character witnesses a bombing and develops tinnitus, which is referenced as a kind of metaphor for his trauma thoughout this dystopian drama	apocalypse; deafened by accident/violence; drama; tinnitus	
China, My Sorrow	Niu-Peng	Sijie Dai	1989	Feature	Cantonese; Mandarin; Shanghainese	China; France; West Germany		During the Cultural Revolution, a young boy is sent to a reeducation camp and befriends a deaf monk, who inspires him with his wisdom. A Chinese-directed film made in Chinese languages in France. 	adoption/foster care; deaf mystic; friendship	
Chinese Roulette	Chinesisches Roulette	Rainer Werner Fassbinder	1976	Feature	German; German Sign Language (DGS)	France; West Germany		Young disabled girl forces her parents to acknowledge their respective affairs, includes passages in sign language	disability; family drama	
Choices		Silvio Narizzano	1981	Feature	English	US		A deaf teen (Paul Carafotes) becomes isolated after he is blocked from playing on a football team due to his deafness	hearing actor in deaf role; isolation; school/university setting; sports	
The Chorus	Hamsarayan	Abbas Kiarostami	1982	Short	Farsi	Iran		A deaf man goes for walk and turns off his hearing aid to avoid noise, but when he returns home he can't hear his granddaughter ringing the doorbell	Coda; hearing aid	
	Choti Si Dunya	Mushtaq Gazdar	2000	Documentary	Pakistani Sign Language	Pakistan		Documentary about the Ida Rieu School for the Deaf and Blind	deaf child; Deaf Culture; deafblind documentary; School for the Deaf; school/university setting	
Christmas Eve on Sesame Street		Jon Stone	1978	Children's feature	American Sign Language (ASL); English	US		Sesame Street TV movie about Christmas Eve includes deaf actor Linda Bove in her recurring role	deaf actor	
Christmas Mission		Michael L. Schaertl	1999	Short	American Sign Language (ASL); English	Canada; US		Religious Christmas TV short includes missionary working with deaf children	deaf child; hearing teacher; religion	
Chronic Embarrassment		Samuel Dore	2001	Short	British Sign Language (BSL)	UK		British Sign Language (BSL) short in which friends at a party tell stories of embarrassing things that have happened to them	comedy; friendship	
	Chup Chup Ke	Priyadarshan; Kookie Gulati	2006	Feature	Hindi	India		Comedy includes hearing man pretending to be deaf to avoid debts	comedy; hearing character pretending to be deaf	
Cleopatra		Joseph L Mankiewicz	1963	Feature	English	US; Switzerland; UK		Hearing actor George Cole plays nonverbal (possibly deaf?) character who signs with Caesar	nonverbal	
Close Encounters of the Third Kind		Steven Spielberg	1977	Feature	Curwen Hand Signs; English	UK; US		The scientists (one of them played by deaf actor/director François Truffaut) use Curwen hand signs (used with musical scales to refer to notes) to communicate with aliens	deaf actor; deaf scientist/medical professional; sci-fi/fantasy	
Clown White		Paul Shapiro	1981	Feature	American Sign Language (ASL); English	Canada		A deaf child goes on a city field trip, runs away	deaf child; school/university setting	
Code Unknown	Code inconnu	Michael Haneke	2001	Feature	English; French; French Sign Language (LSF); Malinka; Romanian	Austria; France; Germany; Romania		A series of interconnected, tragic stories of migrants and other isolated people in Paris, inc. deaf children participating in charades in the opening and closing scenes	deaf child; isolation; school/university setting	
Cold Blood	Sang froid	Pierre-Louis Levacher	2003	Short	French; French Sign Language (LSF)	France		Deaf vampire comedy short	comedy; sci-fi/fantasy	
Cold Case		Jeannot Szwarc	2008	Series	American Sign Language (ASL); English	US		Season 5 episode 14 ("Andy in C Minor") of this Philadelphia crime drama is about the murder of a deaf teen at a School for the Deaf (series duration 2003-10), includes deaf actor Ryan Lane	crime/mystery; deaf child; deaf victim/witness; deaf villain/suspect; School for the Deaf; school/university setting	
Comanche Station 		Budd Boetticher	1960	Feature	Comanche; English; Indian Sign Language (ISL); Turkish	US		Western includes dialogue in Indigenous languages, including Turtle Island sign languages	Indigenous character/themes; western	
Coming Home		Louis Neethling	2009	Short	British Sign Language (BSL); English	UK		Short about an adopted deaf man who inherits his late biological mother's house	deaf child hearing parent; family drama; foster care/adoption	
Coming Out		Louis Neethling	2006	Short	British Sign Language (BSL); English	UK		Short about a young deaf man coming out to his hearing mother	deaf child hearing parent; family drama; queer	
Compensation		Zenaibou Irene Davis	1999	Feature	American Sign Language (ASL); English	US		Drama about a young black deaf woman in early 1900s US	 drama	
The Concorde… Airport '79		David Lowell Rich	1979	Feature	English; French; German; Italian; Spanish	US		Air disaster action drama includes deaf little girl passenger	action; drama	
Confessions of a Cheat	Le roman d'un tricheur	Sacha Guitry	1936	Feature	French	France		Dark drama in which a deaf uncle character accidentally gathers poisonous mushrooms which kill the whole family, except the protagonist who has been denied dinner for stealing. The uncle is the last to die, and as he cries out, the remaining characters are shocked that the 'mute' has a voice	drama; horror	
Congo		Frank Marshall	1995	Feature	American Sign Language (ASL); English; Swahili	US		Michael Crichton sci-fi adaptation includes gorilla who's been taught to sign	sci-fi/fantasy; signing animal	
Control	Kontroll	Nimród Antal	2003	Feature	Hungarian; Hungarian Sign Language (HSL)	Hungary		Mystery comedy about rival train ticket inspectors, includes passages in sign language	comedy; crime/mystery	
Conventioneers		Mora Stephens	2005	Feature	American Sign Language (ASL); English	US		Romantic comedy between a Republic and a Democrat at the Republican National Convention, includes passages in sign language	comedy; romance; romantic comedy	
