English Title	Original Title	Director/Creator	Year	Format	Languages	Countries	Platforms	Summary	Tags	IMDb Tag Number
2AM		Samuel Ash	2020	Short	British Sign Language (BSL)	UK		British Sign Language (BSL) mystery short about a man (deaf actor Nadeem Islam) who wakes up to a ghost in his house	deaf actor; deaf director; deaf producer/writer; all/most dialogue in sign language; thriller	tt13588546
The 5th Wave		J Blakeson	2016	Feature	English	UK; US		Alien attack action sci-fi movie stars Chloë Grace Moretz as a hearing sister trying to protect her deaf little brother played by deaf actor Zachary Arthur	action movie; action; apocalypse; deaf actor; deaf child; sci-fi/fantasy; sibling relationship; survival narrative	tt2304933
13 Minutes		Lindsay Gossling	2021	Feature	American Sign Language (ASL); English	US		Disaster tornado action movie includes deaf character played by Shaylee Mansfield	action; deaf actor; deaf child; survival narrative	tt9274670
25 Minutes of a Lifetime		Bhulla Beghal	2014	Short	British Sign Language (BSL); English	UK		Documentary about an Indian-British deaf woman's experience of cultural and linguistic barriers	accessibility; isolation	tt5599080
50/50		James Banks	2010	Short	British Sign Language (BSL); English	UK		Two men start a scam by having one pretend to be a psychic	crime/mystery; deaf villain/suspect	n/a
100 Humans: Life's Questions, Answered	 	Neil DeGroot; Tom Kramer; David Wechter	2020	Series	American Sign Language (ASL); English	US	Netflix	"Ask a Human" episode of this 8-episode miniseries about various dimensions of the human condition; last episode ends with two women signing	accessibility; disability	tt118230
122		Yasir Alyasiri	2019	Feature	Arabic; Egyptian Sign Language (ESL)	Egypt		Egyptian hospital horror movie in which the main character, Umnia, is deaf but played by hearing actor Amina Khalil	hearing actor in deaf role; horror; medical drama	tt118230
170 Hz		Joost van Ginkel	2011	Feature	Dutch; French Sign Language (LSF)	Netherlands		Short in which two deaf teens fall in love and run away together	drama; hearing actor in deaf role; romance	tt1825636
300 Secs		David Ellington	2013	Documentary	English	UK		Documentary short interviewing Adam Evans, a deaf MMA fighter	deaf sporting excellence; sports	tt3720160
The 355		Simon Kinberg	2022	Feature	American Sign Language (ASL); English	US		Action crime film includes deaf actor Emilio Insolera, with some passage in American Sign Language (ASL)	action; crime/mystery; deaf actor	tt8356942
90 Day Fiancé: Before the 90 Days		Brian Spoor	2017-	Series	American Sign Language (ASL); English	US		Season 6 of this reality tv series about 90-day engagements includes the deaf-hearing couple David (Dangerfield, deaf) and Sheila (Mangubat, hearing)	deaf contestant; deaf-hearing relationship; reality tv	tt7252812
A Beautiful Day in the Neighbourhood		Marielle Heller	2019	Feature	American Sign Language (ASL); English	China; US		Mr Rogers biopic includes scene in which Mr Rogers (Tom Hanks) shows what he thinks is the most beautiful American Sign Language (ASL) sign: 'friend'	biopic; drama; friendship	tt3224458
A Bird of the Air		Margaret Whitton	2011	Feature	American Sign Language (ASL); English	US		Romantic drama includes scene in which main character (Lyman) signs to a deaf librarian, impressing his love interest (Fiona)	drama; romance	tt0448022
A Deaf Life		Jonathan Reid	2010	Short	British Sign Language (BSL)	UK		Short in British Sign Language (BSL) showing bittersweet reflections on deaf life through a man's memories, includes deaf actors Matt Kirby and Samantha Denton	deaf actor; deaf director; all/most dialogue in sign language	tt1686764
A Life Without Words	Une vida sin palabras	Adam Isenberg	2011	Feature	Nicaraguan Sign Language (ISN); Spanish	Nicaragua; Turkey		Two deaf siblings in a rural Nicaraguan village are taught sign language for the first time by a hearing teacher	hearing teacher; 'hearing saviour'; isolation; learning sign; sibling relationship	tt1979384
A Peek of Love		Jeremy Lu	2020	Short	American Sign Language (ASL); English	US		An isolated deaf teen tries to lose her virginity to a hearing jock in an attempt at high school 'normalcy'	deaf-hearing relationship; drama; isolation	tt12199848
A Quiet Love		Garry Keane	2025	Documentary	English; Irish Sign Language (ISL)	Ireland		Documentary about the long-term romantic relationships of three deaf couples in Ireland	Deaf Culture; Deaf Gain; all/most dialogue in sign language; family drama; romance	tt37495241
A Quiet Place		John Krasinski	2018	Feature	American Sign Language (ASL); English	US		High-profile horror franchise in which a deaf girl (deaf actaor Millicent Simmonds) and her family use American Sign Language (ASL) to hide from monsters who hunt by sound	apocalypse; born deaf; character survives dangerous sound thanks to deafness; deaf actor; Deaf Gain; hearing aid; horror; sci-fi/fantasy; sign language used for hiding/secrets; survival narrative	tt6644200
A Quiet Place Part II		John Krasinski	2021	Feature	American Sign Language (ASL); English	US		Sound horror sequel, continuation of a signing family's survival which includes their deaf daughter (deaf actaor Millicent Simmonds) using her hearing aids as a weapon against hyper-hearing monsters	apocalypse; born deaf; character survives dangerous sound thanks to deafness; deaf actor; Deaf Gain; hearing aid; horror; sci-fi/fantasy; sign language used for hiding/secrets; survival narrative	tt8332922
A Silent Agreement		Davo Hardy	2017	Feature	Australian Sign Language (Auslan); English	Australia		A hearing writer with a stammer and a deaf partner (Joshua Sealy) is betrayed by his mentor	deaf actor; deaf-hearing relationship; drama	tt6427368
A Silent Voice	Koe no katachi	Naoko Yamada	2016	Feature	Japanese; Japanese Sign Language (JSL)	Japan		Anime adaptation of a manga about a young hearing man's remorse for bullying a deaf classmate as a child	born deaf; deaf child; deaf child hearing parent; deaf victim/witness; deaf character inspires hearing character’s self-actualisation; school/university setting	tt5323662
A Sonic Pulse		Dorothy Allen-Pickard; Antoine Marinot	2019	Short	British Sign Language (BSL)	UK	Vimeo	Short documentary about deaf people's interactions with and experiences of electronic music	all/most dialogue in sign language; music; vibrations	tt11944548
A Star is Born		Bradley Cooper	2018	Feature	English	US		Country musician Jack (Bradley Cooper) has worsening tinnitus; it is suggested his suicide is partly related to his progressive hearing loss	deaf musician/dancer; deafened by sound exposure; drama; music; progressive hearing loss; romance; tinnitus	tt1517451
Aaron's Consent		Davo Hardy	2014	Short	Australian Sign Language (Auslan); English	Australia		Australian short about a young deaf man with cerebral palsy, Aaron, and his quest for self-determination	accessibility; disability	tt3662142
	Abang Adik	Jin Ong	2023	Feature	Cantonese; Malay; Mandarin	Malaysia; Taiwan 		Neo-noir crimdrama film about a pair of orphans in Malaysia, one deaf-mute, who struggle in a poverty-stricken and crime-ridden enivronment.	crime; drama	tt27445004
Abbott Elementary		Quinta Brunson	2021-	Series	American Sign Language (ASL); English	US	Disney	In season 3 episode 2 of this teacher workplace comedy, Janine encounters endless bureaucratic red tape as she tries to get the school district to hire an ASL interpreter for one of Jacob’s hard of hearing students	comedy; deaf child; friendship; learning sign; school/university setting	tt14218830
Accessibility in Action		JoAnn Smith	2011-3	Series	American Sign Language (ASL); English	Canada		Mini-series about accessibility for various disabilities, includes section on deafness	accessibility; disability	tt1955142
Accused		Marlee Matlin	2023	Series	American Sign Language (ASL); English	US		Season 1 episode 2 ("Ava's Story") of this crime drama series is about a deaf surrogate who protects her deaf baby from the hearing parents getting it a cochlear implant. Includes deaf actors Josh Castille, Marlee Matlin and Stephanie Nogueras	adoption/foster care; cochlear implant; deaf actor; deaf child; deaf director	tt19397024
After My Death	Joi manheun sonyeo	Kim Uisek	2017	Feature	Korean; Korean Sign Language (KSL)	South Korea		Whodunnit about the death of a young girl's best friend begins with unsubtitled signing in a classroom, which sets the tone for ambiguity and mystery	crime/mystery; drama; friendship; school/university setting	tt7390044
Akouse Me		Maria Douza	2022	Feature	Bulgarian; Greek; Greek Sign Language (ENG)	Greece		A young girl in financial distress has to leave her progressive Athens School for the Deaf and move home to her father's island	deaf child; deaf child hearing parent; hearing actor in deaf role; isolation; School for the Deaf; school/university setting	tt16089466
The Alienist		David Caffrey et. al.	2018	Series	English	US	Netflix	Criminal psychology drama set in the 19th century includes Indigenous hearing nonverbal signing character (Mary) who cannot speak due to aphasia, agraphia and trauma	crime/mystery; drama; Indigenous character/themes; nonverbal	tt4604612
All About		Alex Logan	2022	Documentary	American Sign Language (ASL); English	US		Season 2 episode 10 ("Troy Kotsur") episode of the IMDb Originals celebrity special series is about deaf actor, director and writer, Troy Kotsur (series duration 2021-)	born deaf; deaf actor	tt18351796
All the Silence	Todo el silencio	Diego del Rio	2023	Feature	Mexican Sign Language; Spanish	Mexico		A hearing sign language teacher experiences a crisis as she starts to rapidly go deaf herself	deafened by illness; progressive hearing loss	tt29419593
Almost		Teresa Garratty	2020	Short	British Sign Language (BSL); English	UK		Drama short in British Sign Language (BSL) about an encounter between two young women. Includes deaf actors Nadeem Islam, Rose Ayling-Ellis and Vilma Jackson	deaf actor; deaf director; drama	tt11767360
Alone Yet Not Alone		Ray Bengston; George D. Escobar	2013	Feature	English; Plains Indian Sign Language (PISL or Hand Talk)	US		Two German sisters migrate to the colonial US and are abducted by Delaware warriors, includes passages in sign language	Indigenous character/themes; sibling relationship; religion; western	tt1986769
Always Chasing Love		Jadolphus Fraser	2016	Feature	American Sign Language (ASL); English; Italian	US		Drama featuring mostly deaf actors (Alexandria Wailes, Hillary Baack, Modela Kurzet) about the search for their birth parents after entering the foster care system	adoption/foster care; born deaf; deaf actor; deaf child; deaf child hearing parent; drama	tt6069310
American De’VIA Artist: Chuck Baird and his Journey		Tracey Salaway	2010	Documentary	American Sign Language (ASL); English	US		Documentary about founding De'VIA (Deaf View/Image Art) artist, Chuck Baird	deaf artist; Deaf Culture	n/a
American Diablo		Juan Carlos Castañeda	2021	Short	American Sign Language (ASL); English	US		Horror thriller with the tagline "A Deaf Superhero For The Voiceless", about a deaf undocumented Latina woman played by Stephanie Nogueras who must escape the Devil	deaf actor; deaf superhero; horror; religion; survival narrative	tt14810324
American Ninja Warrior		Patrick McManus	2017	Series	English	US		Season 9 episode 5 ("Kansas City Qualifiers") of the reality athletic obstacle course show includes self-named 'Deaf Ninja', Kyle Schulze (series duration 2009-)	deaf contestant; deaf sporting excellence; reality tv; sports	tt7104426
Angry Boys		Chris Lilly	2011	Series	English	Australia		Mockumentary comedy series in which all roles, including a deaf boy, are played by hearing Australian actor Chris Lilly	comedy; hearing actor in deaf role	tt1596589
Anna	Per amor vostro	Guiseppe M. Gaudino	2015	Feature	Italian	France; Italy		Drama about a hearing mother of four, one of whose children is deaf	born deaf; deaf child; deaf child hearing parent; drama	tt4898888
Anne With an E	 	Amanda Tapping	2020	Series	American Sign Language (ASL); English	US		Season 3 episode 10 ("The Better Feelings of My Heart") hearing teacher uses sign in the final episode of this school series (series duration 2017-19)	school/university setting	tt11194730
Aquarium	Akvarium	Bard Rossevold	2011	Short	Norwegian	Norway		Short about a deaf artist who lives reclusively	deaf artist; isolation	tt1625028
Arabian Nights: Volume 2 - The Desolate One		Miguel Gomes	2015	Feature	English; Brazilian Sign Language (LSB); French; German; Italian; Mandarin; Portuguese	France; Germany; Portugal; Switzerland		Second film in transnational adaptation of the Arabian Nights legend, includes passages in sign language	drama	tt4692234
Arcane		Christian Linke; Alex Yee	2021-2024	Series	American Sign Language (ASL); English	France; US		Season 2 (2024) of this animated series adapting the video game League of Legends includes a nonverbal hearing character who signs with their attendant	nonverbal; sci-fi/fantasy	tt11126994
ASL Nook			2013-	Children's series	American Sign Language (ASL)	US		Ongoing children's variety show entirely in American Sign Language (ASL)	deaf actor; deaf director; deaf writer/producer; all/most dialogue in sign language	tt10743086
Assassin 33 A.D.		Jim Carroll	2020	Feature	American Sign Language (ASL); English	US		Scientists uncover a terrorist plot to use a time machine to change history, includes passages in sign language	crime/mystery; thriller	tt8064418
Avec nos yeux	Avec nos yeux	Marion Aldighieri	2013	Documentary	French; French Sign Language (LSF)	France		Documentary about French Deaf people and the International Visual Theatre, including theatre director and actor, Emmanuelle Laborit	accessibility; born deaf; deaf actor	tt2956892
Audible		Matthew Ogens	2021	Short	English	US	Netflix	Short, coming-of-age film about a deaf footballer at the Maryland School for the Deaf who usually only uses his hearing aids to listen to music, rather than for speech	deaf actor; deaf sporting excellence; hearing aid; music; School for the Deaf; school/university setting; sports	
Austin Unbound		Eliza Greenwood; Sel Staley	2010	Documentary	American Sign Language (ASL)	US		Documentary entirely in American Sign Language (ASL) about a deaf transgender man's experience of transition	all/most dialogue in sign language; queer	
Australian Story		Mayeta Clark	2021	Documentary	Australian Sign Language (Auslan); English	Australia	ABC iView	"Sophie's Choice: Li Family" episode of this Australian Broadcasting Corporation documentary profile of young deaf woman Sophie Li's decision to stop wearing the cochlear implants her parents had installed when she was a child, embracing Auslan and the Deaf community	deaf child; deaf child hearing parent; Deaf Culture; cochlear implant	
Avatar: The Way of Water		James Cameron	2022	Feature	English; invented sign language	US		Fantasy colonial sequel includes Na'vi sign language invented by Deaf actor CJ Jones, used underwater and with animals. Those who can't sign are referred to as 'unuseful'	action; Deaf Gain; sci-fi/fantasy; signing animal	
Avenged	Savaged	Michael S. Ojeda	2013	Feature	English	US		Horror action movie in which a deaf girl is murdered by a gang, then is reanimated by the spirit of an Apache warrior who hunts them down	action; deaf mystic; deaf victim/witness; hearing stalker/killer; horror; Indigenous character/themes; revenge/vigilante	
The Avengers		Joss Whedon	2012	Feature	English; Russian	US		Marvel Avengers superhero blockbuster with Mark Ruffalo as Bruce Banner includes original Incredible Hulk actor Lou Ferrigno as Hulk	action; deaf actor; deaf superhero	
Avengers: Age of Ultron		Joss Whedon	2015	Feature	English; Korean	US		Marvel Avengers superhero sequel with Mark Ruffalo as Bruce Banner includes original Incredible Hulk actor Lou Ferrigno as Hulk	action; deaf actor; deaf superhero	
Awaaz		Shilajit Dey	2014	Short	Hindi	India		Deaf filmmaker defies his critics' expectations by making a film with almost no resources	accessibility; Deaf Gain	
Awkward Silence		Manuel Montanez	2018	Short	American Sign Language (ASL); English	US		Short film about communication problems between deaf and hearing partners, includes deaf actor Eddie Buck	deaf actor; deaf-hearing relationship; romance	
Baby Driver		Edgar Wright	2017	Feature	American Sign Language (ASL); English	UK; US	Binge	Getaway driver (Ansel Elgort) who was part-deafened in childhood crash constantly listens to music to mask his tinnitus; lives with a Deaf foster father (played by CJ Jones) and lipreads seamlessly	adoption/foster care; deaf actor; Deaf Gain; deafened by accident/violence; lipreading, inc. magical; music; tinnitus	
The Bachelor		Mike Fleiss	2021	Series	English	US		Season 25 of the dating reality show includes deaf contestant, Abigail Heringer	born deaf; deaf contestant; deaf-hearing relationship; reality tv	
Bachelor in Paradise		Michael Shea	2021	Series	English	US		Season 7 of the dating reality show spin-off featuring original Bachelor and Bachelorette contestants includes Abigail Heringer	born deaf; deaf contestant; deaf-hearing relationship; reality tv	
Bad Judge		Linda Mendoza	2014	Series	American Sign Language (ASL); Chinese Sign Language (CSL); English; Mandarin	US		Season 1 episode 7 ("Communication Breakdown") of this courtroom comedy drama includes a case of a deaf man who steals shoes, includes ASL and CSL interpreters. Includes deaf actor Amanda McDonough	crime/mystery; deaf actor; deaf villain/suspect; hearing actor in deaf role; hearing lawyer of deaf defendant	
	Bajrangi Bhaijaan	Kabir Khan	2015	Feature	Hindi; Indian Sign Language (ISL); Urdu	India		Bollywood action thriller about a man who brings a kidnapped Indian deaf girl back from Pakistan	action; adoption/foster care; Bollywood; deaf child; deaf child hearing parent	
Ballad of a White Cow	Ghasideyeh gave sefid	Maryam Moghadam and Behtash Sanaeeha	2020	Feature	Farsi	France; Iran		Woman with a deaf daughter discovers her husband was innocent of the crime he was executed for	crime/mystery; deaf child; deaf child hearing parent; deaf victim/witness; drama; grief	
Bandidos		Pablo Tébar	2024-	Series	Spanish; Mexican Sign Language (LSM)	Mexico; US		Season 2 of this Mexican heist thriller series includes the recurring deaf character Alex, son of one of the bandidos	action; crime/mystery; deaf child; deaf child hearing parent; revenge/vigilante	
	Barfi!	Anurag Basu	2012	Feature	Hindi	India		Bollywood romantic comedy with Nepalese deaf protagonist	Bollywood; deaf-hearing relationship; romance; romantic comedy	
Battle of Evil: Part II		Rydrea Walker	2014	Feature	American Sign Language (ASL)	US		American Sign Language (ASL)- only thriller in which siblings must fight evil to save their grandfather	all/most dialogue in sign language; horror; sibling relationship; thriller	
Battle Lines		Julian Peedle-Calloo	2014	Short	British Sign Language (BSL); English	UK	URL	A deaf man (Sean Noone) turns to community when he's refused entry into the army for WWI	deaf actor; Deaf Culture; deaf director	
The Bay		Daragh Carville; Richard Clark	2019-	Series	British Sign Language (BSL); English	UK	itv	Crime drama includes deaf actor Nadeem Islam in recurring season 3 role as Jamal	crime/mystery; deaf actor; drama; Nadeem Islam	
The Bear		Christopher Storer	2022-	Series	American Sign Language (ASL); English	US	Disney/FX	In season 2, Carmy and Sydney (two hearing chefs) use the ASL sign for sorry as a circuit breaker during arguments; the switch in modality allows them to defuse tension and apologise even while still feeling emotional	Deaf Gain; drama; learning sign	
Beat		Anastasia Szymanski	2017	Short	American Sign Language (ASL); English	Canada		Short film about a deaf dancer and his relationship with a hearing musician	deaf-hearing relationship; deaf musician/dancer; music; queer	
Beautiful Sounds of Love		Diante Jenkins	2013	Feature	American Sign Language (ASL); English	US		Romance between a hearing man and a deaf woman with trauma due to a history of abuse, as both their exes try to break them up	Amelia Hensley; deaf actor; deaf-hearing relationship; romance; Sandra Mae Frank	
Beauty Scar		Jules Dameron	2019	Short	American Sign Language (ASL)	US		Short romance between two young deaf people staying in a mental institution	Amelia Hensley; deaf actor; deaf director; deaf writer/producer; Miles Barbee; romance	
Becoming Helen Keller		Michael Pressman	2021	Documentary	English	US		Documentary episode of the 'American Masters' series (running since 1985) about Helen Keller's life and disability activism	accessibility; biopic; deafblind documentary; disability; Helen Keller	
Being Michelle		Atin Mehra	2022	Documentary	English	US		Documentary about a deaf woman with autism and her experience of incarceration	accessibility; deaf villain/suspect; disability	
The Bélier Family	La Famille Belier	Eric Lartigau	2014	Feature	French; French Sign Language (LSF); Spanish	Belgium; France		Coda daughter must choose between life on her deaf family's farm and her dreams of a singing career in Paris	Coda; deaf-hearing relationship; drama; family drama; hearing actor in deaf role; music	
Believer	Dokjeon	Hae-Young Lee	2018	Feature	Korean; Korean Sign Language (KSL)	South Korea		Drug cartel thriller includes two deaf drug cooks	crime/mystery; deaf villain/suspect; thriller	
Bent: His Vengeance		Martina Bell	2022	Short	American Sign Language (ASL)	US		American Sign Language (ASL)-only short about a college teacher's strange behaviour throughout a day, leading up to a mysterious "moral decision"	all/most dialogue in sign language; school/university setting	
The Best Day of My Life		Fernando González Molina	2018	Documentary	French Sign Language (LSF); Spanish	Spain		Pride documentary about six proud queer people, one of whom is a deaf man from France	queer	
Between Shadows and Whispers	Entre Sombras y Seruros	Samuel Henríquez	2012	Documentary	Spanish	Venezuela		Story of deafblind Venezuelan woman who learns to speak at the age of 55, then to teach others speech	deafblind documentary; learning speech	
Beware the Gorilla	Attenti al gorilla	Luca Miniero	2019	Feature	invented sign language; Italian	Italy		Recently-divorced lawyer commits himself to helping a captive gorilla, including some signing communication	signing animal	
Beyond Inclusion		Ryan Commerson	2016	Documentary	American Sign Language (ASL); English	US		Documentary short on the concepts of 'diversity' and 'disability' following the Americans with Disabilities Act of 1990, includes interview with Nyle DiMarco	accessibility; disability; Nyle DiMarco	
The Big Bang Theory		Mark Cendrowski	2007-19	Series	American Sign Language (ASL); English	US		In Season 5 Episode 4 ("The Wiggly Finger Catalyst", 2011), hearing man Raj dates deaf woman Emily (Katie Leclerc) who accepts his sporadic non verbalism but turns out to be a gold digger	comedy; deaf actor; deaf villain/suspect; deaf-hearing relationship; nonverbal character; romantic comedy	
Big Eyes		Tim Burton	2014	Feature	English; French; Italian	Canada; US		Biopic of painter Margaret Keane (Amy Adams) known for her figures with large eyes, who was partially deafened in childhood	biopic; deaf artist; deafened by accident/violence; drama	
The Biggest Obstacle		Gearóid Dolan	2021	Documentary	English	US		Documentary about disability activists' fight to make the NYC subway system truly accessible, includes non-signing hard of hearing person	accessibility; disability	
Black Lightning		Salim Akil	2017-21	Series	American Sign Language (ASL); English	US	Netflix	Black superhero series includes deaf actor Warren "Wawa" Snipes in episodes 6 and 7, who gives the hero his sign name	deaf actor; deaf superhero; Warren Snipes	
Black Sand		Mark Wood	2010	Feature	American Sign Language (ASL)	US		American Sign Language (ASL)-only horror film about a group of deaf people on an island	all/most dialogue in sign language; horror; survival narrative	
Black Summer		John Hyams; Karl Schaefer	2019-2021	Series	American Sign Language (ASL); English	US	Netflix	Spinoff of the series Z Nation depicting the early days of a zombie apocalypse includes deaf Syrian actor Mustafa Alabbsi in some episodes	apocalypse; deaf actor; Mustafa Alabbsi; survival narrative	
Blessing	Mugisha	Fisca Jean Paul Habimana	2021	Short	English; Rwandan Sign Language (RSL)	Rwanda		Short about the relationship between a deaf couple, shoemaker Eric and his wife, Marie Jeanne	drama; romance	
Blue Canvas of Youthful Days		Li Xi; Ning Yuan Yuan 	2024-	Series	English	China		A drama series about online friends meeting unexpectedly in real life, and manage to grow closer, and their friendship begins to develop into something else entirely.	drama; romance	tt34071601
Blue Sky		Pietro Nigro Famulari	2009	Short	English	US		Romance short between hearing boy who writes and deaf girl who draws	deaf artist; deaf-hearing relationship; romance	
Bluey		Richard Jeffery	2022	Children's series	Australian Sign Language (Auslan); English	Australia		Season 3 episode 30 ("Turtle Boy") of the children's series about an Australian cattle dog includes and normalises Auslan (series duration 2018-)	deaf child; Deaf Gain; signing animal	
Boardwalk Empire		Timothy Van Patten	2010	Series	English	US		Season 1 episode 6 ("Family Limitation") of the New Jersey Mafia series set in the 1920s includes Sonny Capone, Al Capone's deaf son (series duration 2010-14)	crime/mystery; deaf villain/suspect; deafened by illness; drama	
Boat		Louise Stern	2018	Short	British Sign Language (BSL); English	UK		A young deaf woman rents the spare room on a boat where she lives with a gregarious hearing man, communicates through writing, gesture and dance	deaf actor; deaf director; deaf writer/producer; deaf-hearing relationship	
